tierDescription|issueSymbolIdentifier|issueName|marketParticipantName|totalWeeklyShareQuantity|totalWeeklyTradeCount|lastUpdateDate
NMS Tier 2|ING|ING Groep N.V. American Depositary Shares|CITADEL SECURITIES LLC|540787|1029|2019-06-24
NMS Tier 2|ING|ING Groep N.V. American Depositary Shares|De Minimis Firms|5872266|1580|2019-06-24
NMS Tier 2|INGN|Inogen, Inc Common Stock|De Minimis Firms|517782|1760|2019-06-24
NMS Tier 2|INKM|SPDR SSgA Income Allocation ETF of SSgA Active Trust|De Minimis Firms|9688|52|2019-06-24
NMS Tier 2|INMB|INmune Bio Inc. Common stock|De Minimis Firms|79497|282|2019-06-24
NMS Tier 2|INN|Summit Hotel Properties, Inc.|De Minimis Firms|154946|743|2019-06-24
NMS Tier 2|INN$D|Summit Hotel Properties, Inc. 6.45% Series D Cumulative Redeemable Preferred Stock|De Minimis Firms|3951|32|2019-06-24
NMS Tier 2|INN$E|Summit Hotel Properties, Inc. 6.250% Series E Cumulative Redeemable Preferred Stock|De Minimis Firms|24796|52|2019-06-24
NMS Tier 2|INNT|Innovate Biopharmaceuticals, Inc. Common Stock|De Minimis Firms|1954901|2939|2019-06-24
NMS Tier 2|INO|Inovio Pharmaceuticals, Inc. Common Stock|De Minimis Firms|1159991|1632|2019-06-24
NMS Tier 2|INOD|Innodata Inc. Common Stock|De Minimis Firms|47598|76|2019-06-24
NMS Tier 2|INOV|Inovalon Holdings, Inc. Class A Common Stock|De Minimis Firms|142904|415|2019-06-24
NMS Tier 2|INPX|Inpixon Common Stock|De Minimis Firms|1014731|1212|2019-06-24
NMS Tier 2|INPX|Inpixon Common Stock|G1 EXECUTION SERVICES, LLC|494094|1292|2019-06-24
NMS Tier 2|INPX|Inpixon Common Stock|WOLVERINE SECURITIES, LLC|591471|2602|2019-06-24
NMS Tier 2|INR|Market Vectors-Rupee|De Minimis Firms|1|1|2019-06-24
NMS Tier 2|INS|Intelligent Systems Corp.|CITADEL SECURITIES LLC|155637|1249|2019-06-24
NMS Tier 2|INS|Intelligent Systems Corp.|De Minimis Firms|274416|1719|2019-06-24
NMS Tier 2|INSE|Inspired Entertainment, Inc. Common Stock|De Minimis Firms|7098|34|2019-06-24
NMS Tier 2|INSG|Inseego Corp. Common Stock|CITADEL SECURITIES LLC|1392851|2773|2019-06-24
NMS Tier 2|INSG|Inseego Corp. Common Stock|De Minimis Firms|753941|1408|2019-06-24
NMS Tier 2|INSG|Inseego Corp. Common Stock|VIRTU AMERICAS LLC|722889|1448|2019-06-24
NMS Tier 2|INSI|Insight Select Income Fund|De Minimis Firms|39463|104|2019-06-24
NMS Tier 2|INSM|Insmed, Inc. Common Stock|CITADEL SECURITIES LLC|423468|2247|2019-06-24
NMS Tier 2|INSM|Insmed, Inc. Common Stock|De Minimis Firms|569368|1982|2019-06-24
NMS Tier 2|INSP|Inspire Medical Systems, Inc.|De Minimis Firms|136572|742|2019-06-24
NMS Tier 2|INST|Instructure, Inc.|De Minimis Firms|65314|391|2019-06-24
NMS Tier 2|INSW|International Seaways, Inc. Common Stock|De Minimis Firms|37045|216|2019-06-24
NMS Tier 2|INSW$A|International Seaways, Inc. 8.50% Senior Notes due June 30, 2023|De Minimis Firms|7116|24|2019-06-24
NMS Tier 2|INSY|Insys Therapeutics, Inc. Common Stock|CITADEL SECURITIES LLC|994042|1482|2019-06-24
NMS Tier 2|INSY|Insys Therapeutics, Inc. Common Stock|De Minimis Firms|1035212|1989|2019-06-24
NMS Tier 2|INSY|Insys Therapeutics, Inc. Common Stock|G1 EXECUTION SERVICES, LLC|515771|1030|2019-06-24
NMS Tier 2|INT|World Fuel Services Corporation|De Minimis Firms|358220|835|2019-06-24
NMS Tier 2|INTG|Intergroup Corporation (The) Common Stock|De Minimis Firms|8899|29|2019-06-24
NMS Tier 2|INTL|INTL FCStone Inc. Common Stock|De Minimis Firms|124261|285|2019-06-24
NMS Tier 2|INTT|inTEST Corporation|De Minimis Firms|65089|340|2019-06-24
NMS Tier 2|INUV|Inuvo, Inc.|De Minimis Firms|360156|353|2019-06-24
NMS Tier 2|INVA|Innoviva, Inc. Common Stock|De Minimis Firms|3093749|1274|2019-06-24
NMS Tier 2|INVE|Identiv, Inc. Common Stock|De Minimis Firms|34730|153|2019-06-24
NMS Tier 2|INWK|InnerWorkings, Inc. Common Stock|De Minimis Firms|74510|356|2019-06-24
NMS Tier 2|INXN|Interxion Holding N.V.|De Minimis Firms|191861|1343|2019-06-24
NMS Tier 2|INXX|Columbia India Infrastructure ETF|De Minimis Firms|31855|73|2019-06-24
NMS Tier 2|IO|ION Geophysical Corporation|De Minimis Firms|296804|734|2019-06-24
NMS Tier 2|IOR|Income Opportunity Realty Investors, Inc.|De Minimis Firms|202|3|2019-06-24
NMS Tier 2|IOSP|Innospec Inc. Common Stock|De Minimis Firms|146014|513|2019-06-24
NMS Tier 2|IOTS|Adesto Technologies Corporation Common Stock|De Minimis Firms|207909|795|2019-06-24
NMS Tier 2|IOVA|Iovance Biotherapeutics, Inc. Common Stock|ACS EXECUTION SERVICES, LLC|107545|1104|2019-06-24
NMS Tier 2|IOVA|Iovance Biotherapeutics, Inc. Common Stock|CITADEL SECURITIES LLC|1302417|4532|2019-06-24
NMS Tier 2|IOVA|Iovance Biotherapeutics, Inc. Common Stock|De Minimis Firms|827208|1008|2019-06-24
NMS Tier 2|IOVA|Iovance Biotherapeutics, Inc. Common Stock|G1 EXECUTION SERVICES, LLC|572539|1829|2019-06-24
NMS Tier 2|IOVA|Iovance Biotherapeutics, Inc. Common Stock|VIRTU AMERICAS LLC|761501|2140|2019-06-24
NMS Tier 2|IPAR|Inter Parfums, Inc. Common Stock|De Minimis Firms|54182|535|2019-06-24
NMS Tier 2|IPB|Merrill Lynch 6.0518% Index Plus Trust Certificates Series 2003-1|De Minimis Firms|1275|11|2019-06-24
NMS Tier 2|IPDN|Professional Diversity Network, Inc. Common Stock|De Minimis Firms|26187|69|2019-06-24
NMS Tier 2|IPFF|iShares International Preferred Stock ETF|De Minimis Firms|30179|112|2019-06-24
NMS Tier 2|IPHI|INPHI CORPORATION|CITADEL SECURITIES LLC|274721|1333|2019-06-24
NMS Tier 2|IPHI|INPHI CORPORATION|De Minimis Firms|487432|1557|2019-06-24
NMS Tier 2|IPHS|Innophos Holdings, Inc. Common Stock|De Minimis Firms|134312|453|2019-06-24
NMS Tier 2|IPI|Intrepid Potash, Inc|De Minimis Firms|748898|950|2019-06-24
NMS Tier 2|IPIC|iPic Entertainment Inc. Class A Common Stock|De Minimis Firms|12658|61|2019-06-24
NMS Tier 2|IPKW|Invesco Exchange-Traded Fund Trust II Invesco International BuyBack Achievers ETF|De Minimis Firms|63148|264|2019-06-24
NMS Tier 2|IPLDP|Interstate Power & Light Company Perp Prd Ser D|De Minimis Firms|12002|91|2019-06-24
NMS Tier 2|IPO|Renaissance IPO ETF|De Minimis Firms|63605|302|2019-06-24
NMS Tier 2|IPOA|Social Capital Hedosophia Holdings Corp. Class A ordinary shares, par value $0.0001|De Minimis Firms|15411|111|2019-06-24
NMS Tier 2|IPOA.U|Social Capital Hedosophia Holdings Corp.|De Minimis Firms|10372|21|2019-06-24
NMS Tier 2|IPOA.W|Social Capital Hedosophia Holdings Corp. Warrants, each whole warrant exercisable for one Class A Or|De Minimis Firms|63430|6|2019-06-24
NMS Tier 2|IPOS|Renaissance International IPO ETF|De Minimis Firms|145|10|2019-06-24
NMS Tier 2|IPWR|Ideal Power Inc. Common Stock|De Minimis Firms|436564|647|2019-06-24
NMS Tier 2|IQ|iQIYI, Inc. American Depositary Shares|CITADEL SECURITIES LLC|4022595|7782|2019-06-24
NMS Tier 2|IQ|iQIYI, Inc. American Depositary Shares|De Minimis Firms|2696460|2172|2019-06-24
NMS Tier 2|IQ|iQIYI, Inc. American Depositary Shares|G1 EXECUTION SERVICES, LLC|1571392|1866|2019-06-24
NMS Tier 2|IQ|iQIYI, Inc. American Depositary Shares|VIRTU AMERICAS LLC|1951768|3651|2019-06-24
NMS Tier 2|IQ|iQIYI, Inc. American Depositary Shares|WOLVERINE SECURITIES, LLC|286641|3061|2019-06-24
NMS Tier 2|IQDE|FlexShares International Quality Dividend Defensive Index Fund|De Minimis Firms|62662|43|2019-06-24
NMS Tier 2|IQDG|WisdomTree International Quality Dividend Growth Fund|De Minimis Firms|22942|136|2019-06-24
NMS Tier 2|IQDY|FlexShares International Quality Dividend Dynamic Index Fund|De Minimis Firms|24756|30|2019-06-24
NMS Tier 2|IQI|INVESCO QUALITY MUNICIPAL SECURITIES|De Minimis Firms|256313|543|2019-06-24
NMS Tier 2|IQLT|iShares Edge MSCI Intl Quality Factor ETF|De Minimis Firms|395889|907|2019-06-24
NMS Tier 2|IRBO|iShares Robotics and Artificial Intelligence ETF|De Minimis Firms|33143|254|2019-06-24
NMS Tier 2|IRBT|iRobot Corporation Common Stock|CITADEL SECURITIES LLC|180750|1686|2019-06-24
NMS Tier 2|IRBT|iRobot Corporation Common Stock|De Minimis Firms|196059|2021|2019-06-24
NMS Tier 2|IRCP|IRSA Propiedades Comerciales S.A. American Depositary Shares|De Minimis Firms|5137|19|2019-06-24
NMS Tier 2|IRDM|Iridium Communications Inc Common Stock|CITADEL SECURITIES LLC|364254|1578|2019-06-24
NMS Tier 2|IRDM|Iridium Communications Inc Common Stock|De Minimis Firms|550475|1668|2019-06-24
NMS Tier 2|IRET|Investors Real Estate Trust|De Minimis Firms|22057|245|2019-06-24
NMS Tier 2|IRET$C|Investors Real Estate Trust 6.625 Percent Series C Cumulative Redeemable Preferred Shares (Liquidati|De Minimis Firms|6156|25|2019-06-24
NMS Tier 2|IRIX|IRIDEX Corporation Common Stock|De Minimis Firms|116528|576|2019-06-24
NMS Tier 2|IRL|NEW IRELAND FUND INC|De Minimis Firms|16788|46|2019-06-24
NMS Tier 2|IRMD|iRadimed Corporation Common Stock|De Minimis Firms|40976|225|2019-06-24
NMS Tier 2|IROQ|IF Bancorp, Inc. Common Stock|De Minimis Firms|5358|19|2019-06-24
NMS Tier 2|IRR|VOYA NATURAL RESOURCES EQUITY INCOME FUND|De Minimis Firms|96091|185|2019-06-24
NMS Tier 2|IRS|IRSA Inversiones y Representaciones S.A. Global Depositary Shares|De Minimis Firms|63171|211|2019-06-24
NMS Tier 2|IRT|Independence Realty Trust Inc.|De Minimis Firms|332794|955|2019-06-24
NMS Tier 2|IRTC|iRhythm Technologies, Inc. Common Stock|De Minimis Firms|213080|1363|2019-06-24
NMS Tier 2|IRWD|Ironwood Pharmaceuticals, Inc. Class A Common Stock|De Minimis Firms|882705|1930|2019-06-24
NMS Tier 2|ISBC|Investors Bancorp, Inc. Common Stock|De Minimis Firms|1812937|1485|2019-06-24
NMS Tier 2|ISCA|International Speedway Corporation Class A Common Stock|De Minimis Firms|77393|655|2019-06-24
NMS Tier 2|ISCF|iShares Edge MSCI Multifactor Intl Small-Cap ETF|De Minimis Firms|26080|105|2019-06-24
NMS Tier 2|ISD|PGIM High Yield Bond Fund, Inc.|De Minimis Firms|160537|664|2019-06-24
NMS Tier 2|ISDR|Issuer Direct Corporation|De Minimis Firms|6189|38|2019-06-24
NMS Tier 2|ISDX|Invesco Exchange-Traded Self-Indexed Fund Trust Invesco RAFI Strategic Developed ex-US ETF|De Minimis Firms|5486|2|2019-06-24
NMS Tier 2|ISEE|IVERIC bio, Inc. Common Stock|De Minimis Firms|234982|237|2019-06-24
NMS Tier 2|ISF|ING GROEP N.V. 6.375% ING Perpetual Hybrid Capital Securities Called Redemption|De Minimis Firms|58832|253|2019-06-24
NMS Tier 2|ISG|ING Groep N.V. 6.125% ING Perpetual Debt Securities|De Minimis Firms|47341|260|2019-06-24
NMS Tier 2|ISHG|iShares Trust iShares 1-3 Year International Treasury Bond ETF|De Minimis Firms|14790|34|2019-06-24
NMS Tier 2|ISIG|Insignia Systems, Inc. Common Stock|De Minimis Firms|6386|53|2019-06-24
NMS Tier 2|ISMD|Inspire Small/Mid Cap Impact ETF|De Minimis Firms|27225|122|2019-06-24
NMS Tier 2|ISNS|Image Sensing Systems, Inc. Common Stock|De Minimis Firms|28973|49|2019-06-24
NMS Tier 2|ISR|IsoRay, Inc.|De Minimis Firms|944969|486|2019-06-24
NMS Tier 2|ISRA|Market Vectors Israel ETF|De Minimis Firms|7047|65|2019-06-24
NMS Tier 2|ISRL|Isramco, Inc. Common Stock|De Minimis Firms|668|24|2019-06-24
NMS Tier 2|ISSC|Innovative Solutions and Support, Inc. Common Stock|De Minimis Firms|76535|199|2019-06-24
NMS Tier 2|ISTR|Investar Holding Corporation Common Stock|De Minimis Firms|12694|92|2019-06-24
NMS Tier 2|ISZE|iShares Edge MSCI Intl Size Factor ETF|De Minimis Firms|3|3|2019-06-24
NMS Tier 2|ITCB|Itau CorpBanca|De Minimis Firms|3564|31|2019-06-24
NMS Tier 2|ITCI|Intra-Cellular Therapies Inc. Common Stock|De Minimis Firms|353754|973|2019-06-24
NMS Tier 2|ITEQ|BlueStar Israel Technology ETF|De Minimis Firms|20997|166|2019-06-24
NMS Tier 2|ITGR|Integer Holdings Corporation|De Minimis Firms|317166|443|2019-06-24
NMS Tier 2|ITI|Iteris, Inc. Common Stock|De Minimis Firms|108329|367|2019-06-24
NMS Tier 2|ITIC|Investors Title Company Common Stock|De Minimis Firms|1799|57|2019-06-24
NMS Tier 2|ITM|VanEck Vectors AMT-Free Intermediate Municipal Index ETF|De Minimis Firms|202478|365|2019-06-24
NMS Tier 2|ITMR|Itamar Medical Ltd. American Depository Shares|De Minimis Firms|859|8|2019-06-24
NMS Tier 2|ITP|IT Tech Packaging, Inc.|De Minimis Firms|9996|52|2019-06-24
NMS Tier 2|ITRI|Itron, Inc. Common Stock|De Minimis Firms|148888|894|2019-06-24
NMS Tier 2|ITRM|Iterum Therapeutics plc Ordinary Share|De Minimis Firms|12813|40|2019-06-24
NMS Tier 2|ITRN|Ituran Location and Control Ltd. Ordinary Shares|De Minimis Firms|321726|275|2019-06-24
NMS Tier 2|ITUB|Itau Unibanco Holding S.A. American Depositary Shares|CITADEL SECURITIES LLC|6168105|3419|2019-06-24
NMS Tier 2|ITUB|Itau Unibanco Holding S.A. American Depositary Shares|De Minimis Firms|22950890|1478|2019-06-24
NMS Tier 2|ITUB|Itau Unibanco Holding S.A. American Depositary Shares|VIRTU AMERICAS LLC|1320369|1009|2019-06-24
NMS Tier 2|IUS|Invesco Exchange-Traded Self-Indexed Fund Trust Invesco RAFI Strategic US ETF|De Minimis Firms|172|1|2019-06-24
NMS Tier 2|IUSS|Invesco Exchange-Traded Self-Indexed Fund Trust Invesco RAFI Strategic US Small Company ETF|De Minimis Firms|20000|1|2019-06-24
NMS Tier 2|IVAC|Intevac, Inc. Common Stock|De Minimis Firms|49613|132|2019-06-24
NMS Tier 2|IVAL|Alpha Architect International Quantitative Value ETF|De Minimis Firms|10366|56|2019-06-24
NMS Tier 2|IVC|Invacare Corporation|De Minimis Firms|363890|454|2019-06-24
NMS Tier 2|IVH|Ivy Credit Opportunities Fund|De Minimis Firms|71515|240|2019-06-24
NMS Tier 2|IVLU|iShares Edge MSCI Intl Value Factor ETF|De Minimis Firms|430827|169|2019-06-24
NMS Tier 2|IVOL|Quadratic Interest Rate Volatility and Inflation Hedge ETF|De Minimis Firms|35437|193|2019-06-24
NMS Tier 2|IVOV|Vanguard S&P Mid-Cap 400 Value ETF|De Minimis Firms|29866|319|2019-06-24
NMS Tier 2|IVR|Invesco Mortgage Capital Inc.|De Minimis Firms|1127296|1149|2019-06-24
NMS Tier 2|IVR$A|INVESCO MORTGAGE CAPITAL INC. 7.75% Series A Cumulative Redeemable Preferred Stock,|De Minimis Firms|12202|54|2019-06-24
NMS Tier 2|IVR$B|INVESCO MORTGAGE CAPITAL INC. 7.75% Fixed-To-Floating Series B Cumulative Redeemable Preferred Stock|De Minimis Firms|6783|91|2019-06-24
NMS Tier 2|IVR$C|Invesco Mortgage Capital Inc. 7.5% Fixed-to-Floating Series C Cumulative Redeemable Preferred Stock,|De Minimis Firms|78475|279|2019-06-24
NMS Tier 2|IWL|iShares Russell Top 200 ETF|De Minimis Firms|119879|239|2019-06-24
NMS Tier 2|IWX|iShares Russell Top 200 Value ETF|De Minimis Firms|54750|221|2019-06-24
NMS Tier 2|IX|ORIX Corporation|De Minimis Firms|48998|532|2019-06-24
NMS Tier 2|IXSE|WisdomTree India Ex-State-Owned Enterprises Fund|De Minimis Firms|242|2|2019-06-24
NMS Tier 2|IYLD|iShares Morningstar Multi-Asset Income ETF|De Minimis Firms|123956|388|2019-06-24
NMS Tier 2|IZEA|IZEA Worldwide, Inc. Common Stock|De Minimis Firms|400574|574|2019-06-24
NMS Tier 2|IZRL|ARK Israel Innovative Technology ETF|De Minimis Firms|5529|54|2019-06-24
NMS Tier 2|JACK|Jack In The Box Inc. Common Stock|De Minimis Firms|473786|2187|2019-06-24
NMS Tier 2|JAG|Jagged Peak Energy Inc.|CITADEL SECURITIES LLC|165264|1140|2019-06-24
NMS Tier 2|JAG|Jagged Peak Energy Inc.|De Minimis Firms|457905|754|2019-06-24
NMS Tier 2|JAGX|Jaguar Health, Inc. Common Stock|CITADEL SECURITIES LLC|2993856|1105|2019-06-24
NMS Tier 2|JAGX|Jaguar Health, Inc. Common Stock|De Minimis Firms|3129976|980|2019-06-24
NMS Tier 2|JAGX|Jaguar Health, Inc. Common Stock|G1 EXECUTION SERVICES, LLC|2136646|2304|2019-06-24
NMS Tier 2|JAGX|Jaguar Health, Inc. Common Stock|WOLVERINE SECURITIES, LLC|2327766|4010|2019-06-24
NMS Tier 2|JAKK|JAKKS Pacific, Inc. Common Stock|De Minimis Firms|104138|200|2019-06-24
NMS Tier 2|JAMF|WisdomTree Japan Multifactor Fund|De Minimis Firms|2|2|2019-06-24
NMS Tier 2|JASN|Jason Industries, Inc. Common Stock|De Minimis Firms|423646|512|2019-06-24
NMS Tier 2|JASNW|Jason Industries, Inc. Warrant|De Minimis Firms|24447|9|2019-06-24
NMS Tier 2|JAX|J. Alexander's Holdings, Inc.|De Minimis Firms|77482|258|2019-06-24
NMS Tier 2|JBK|Lehman ABS Corp 3.50 Adj Corp Backed Tr Cert Goldman Cap I|De Minimis Firms|101|1|2019-06-24
NMS Tier 2|JBN|Corporate Backed Callable Trust Certificates, J.C. Penney Debenture-Backed Series 2007-1 Trust|De Minimis Firms|8964|36|2019-06-24
NMS Tier 2|JBR|Corporate Backed Callable Trust Certificates, J.C. Penny Debenture-Backed Series 2006-1 Trust|De Minimis Firms|12473|34|2019-06-24
NMS Tier 2|JBSS|John B. Sanfilippo & Son, Inc. Common Stock|De Minimis Firms|14767|432|2019-06-24
NMS Tier 2|JBT|John Bean Technologies Corporation|De Minimis Firms|62707|555|2019-06-24
NMS Tier 2|JCAP|Jernigan Capital, Inc.|De Minimis Firms|79565|443|2019-06-24
NMS Tier 2|JCAP$B|Jernigan Capital, Inc. 7.00% Series B Cumulative Redeemable Perpetual Preferred Stock|De Minimis Firms|7876|16|2019-06-24
NMS Tier 2|JCE|Nuveen Core Equity Alpha Fund|De Minimis Firms|76627|170|2019-06-24
NMS Tier 2|JCO|Nuveen Credit Opportunities 2022 Target Term Fund|De Minimis Firms|113727|191|2019-06-24
NMS Tier 2|JCOM|j2 Global, Inc. Common Stock|De Minimis Firms|220779|1230|2019-06-24
NMS Tier 2|JCP|J.C. Penney Company, Inc.|CITADEL SECURITIES LLC|11346959|5153|2019-06-24
NMS Tier 2|JCP|J.C. Penney Company, Inc.|De Minimis Firms|1338295|875|2019-06-24
NMS Tier 2|JCP|J.C. Penney Company, Inc.|G1 EXECUTION SERVICES, LLC|3723566|1355|2019-06-24
NMS Tier 2|JCP|J.C. Penney Company, Inc.|TWO SIGMA SECURITIES, LLC|1683401|1584|2019-06-24
NMS Tier 2|JCP|J.C. Penney Company, Inc.|VIRTU AMERICAS LLC|4335368|4767|2019-06-24
NMS Tier 2|JCP|J.C. Penney Company, Inc.|WOLVERINE SECURITIES, LLC|2573789|4529|2019-06-24
NMS Tier 2|JCPB|JPMorgan Core Plus Bond ETF|De Minimis Firms|133|5|2019-06-24
NMS Tier 2|JCS|Communications Systems, Inc. Common Stock|De Minimis Firms|6971|42|2019-06-24
NMS Tier 2|JCTCF|Jewett-Cameron Trading Company Common Shares|De Minimis Firms|9106|29|2019-06-24
NMS Tier 2|JD|JD.com, Inc. American Depositary Shares|CITADEL SECURITIES LLC|5428280|10272|2019-06-24
NMS Tier 2|JD|JD.com, Inc. American Depositary Shares|De Minimis Firms|5525535|3771|2019-06-24
NMS Tier 2|JD|JD.com, Inc. American Depositary Shares|G1 EXECUTION SERVICES, LLC|2435725|2721|2019-06-24
NMS Tier 2|JD|JD.com, Inc. American Depositary Shares|TWO SIGMA SECURITIES, LLC|635329|1561|2019-06-24
NMS Tier 2|JD|JD.com, Inc. American Depositary Shares|VIRTU AMERICAS LLC|3179667|5117|2019-06-24
NMS Tier 2|JDD|Nuveen Diversified Dividend and Income Fund|De Minimis Firms|126437|296|2019-06-24
NMS Tier 2|JDIV|JPMorgan U.S. Dividend ETF|De Minimis Firms|113165|24|2019-06-24
NMS Tier 2|JDST|Direxion Daily Junior Gold Miners Index Bear 3X Shares|CITADEL SECURITIES LLC|276904|1039|2019-06-24
NMS Tier 2|JDST|Direxion Daily Junior Gold Miners Index Bear 3X Shares|De Minimis Firms|194237|835|2019-06-24
NMS Tier 2|JDST|Direxion Daily Junior Gold Miners Index Bear 3X Shares|G1 EXECUTION SERVICES, LLC|128033|1006|2019-06-24
NMS Tier 2|JE|JUST ENERGY GROUP INC.|De Minimis Firms|354401|783|2019-06-24
NMS Tier 2|JE$A|Just Energy Group Inc. 8.50% Series A Fixed-to-Floating Rate Cumulative Redeemable Perpetual Preferr|De Minimis Firms|36017|180|2019-06-24
NMS Tier 2|JELD|JELD-WEN Holding, Inc.|De Minimis Firms|120963|677|2019-06-24
NMS Tier 2|JEMD|Nuveen Emerging Markets Debt 2022 Target Term Fund, Common Shares of Beneficial Interest, $0.01 par|De Minimis Firms|42960|72|2019-06-24
NMS Tier 2|JEQ|ABERDEEN JAPAN EQUITY FUND|De Minimis Firms|61722|68|2019-06-24
NMS Tier 2|JETS|U.S. Global Jets ETF|De Minimis Firms|25710|134|2019-06-24
NMS Tier 2|JFIN|Jiayin Group Inc. American Depositary Shares|De Minimis Firms|196552|1176|2019-06-24
NMS Tier 2|JFK|8i Enterprises Acquisition Corp Ordinary Shares|De Minimis Firms|54300|4|2019-06-24
NMS Tier 2|JFKKR|8i Enterprises Acquisition Corp Right|De Minimis Firms|5900|10|2019-06-24
NMS Tier 2|JFKKU|8i Enterprises Acquisition Corp Unit|De Minimis Firms|29780|17|2019-06-24
NMS Tier 2|JFKKW|8i Enterprises Acquisition Corp Warrant|De Minimis Firms|278000|19|2019-06-24
NMS Tier 2|JFR|Nuveen Floating Rate Income Fund|De Minimis Firms|288534|641|2019-06-24
NMS Tier 2|JG|Aurora Mobile Limited American Depositary Shares|De Minimis Firms|99388|349|2019-06-24
NMS Tier 2|JGH|NUVEEN GLOBAL HIGH INCOME FUND|De Minimis Firms|97940|407|2019-06-24
NMS Tier 2|JHAA|Nuveen High Income 2023 Target Term Fund Common Shares of Beneficial Interest|De Minimis Firms|56334|76|2019-06-24
NMS Tier 2|JHB|Nuveen High Income November 2021 Target Term Fund|De Minimis Firms|224944|402|2019-06-24
NMS Tier 2|JHCS|John Hancock Multifactor Media and Communications ETF|De Minimis Firms|4585|19|2019-06-24
NMS Tier 2|JHD|Nuveen High Income December 2019 Target Term Fund|De Minimis Firms|129287|266|2019-06-24
NMS Tier 2|JHG|Janus Henderson Group plc Ordinary Shares|De Minimis Firms|204076|1515|2019-06-24
NMS Tier 2|JHI|John Hancock Investors Trust Capital Stock|De Minimis Firms|55253|158|2019-06-24
NMS Tier 2|JHMA|John Hancock Multifactor Materials ETF|De Minimis Firms|1037|6|2019-06-24
NMS Tier 2|JHMC|John Hancock Multifactor Consumer Discretionary ETF|De Minimis Firms|15554|81|2019-06-24
NMS Tier 2|JHME|John Hancock Multifactor Energy ETF|De Minimis Firms|10698|123|2019-06-24
NMS Tier 2|JHMF|John Hancock Multifactor Financials ETF|De Minimis Firms|18210|67|2019-06-24
NMS Tier 2|JHMH|John Hancock Multifactor Healthcare ETF|De Minimis Firms|9276|67|2019-06-24
NMS Tier 2|JHMI|John Hancock Multifactor Industrials ETF|De Minimis Firms|8207|28|2019-06-24
NMS Tier 2|JHMS|John Hancock Multifactor Consumer Staples ETF|De Minimis Firms|2275|77|2019-06-24
NMS Tier 2|JHMT|John Hancock Multifactor Technology ETF|De Minimis Firms|10875|114|2019-06-24
NMS Tier 2|JHMU|John Hancock Multifactor Utilities ETF|De Minimis Firms|14518|115|2019-06-24
NMS Tier 2|JHS|John Hancock Income Securities Trust Capital Stock|De Minimis Firms|33955|114|2019-06-24
NMS Tier 2|JHX|JAMES HARDIE INDUSTRIES plc.|De Minimis Firms|13093|107|2019-06-24
NMS Tier 2|JHY|Nuveen High Income 2020 Target Term Fund Common Shares of Beneficial Interest|De Minimis Firms|92101|206|2019-06-24
NMS Tier 2|JILL|J.Jill, Inc. Common Stock|De Minimis Firms|640507|1273|2019-06-24
NMS Tier 2|JJA|iPath Series B Bloomberg Agriculture Subindex Total ReturnSM ETN|De Minimis Firms|133|3|2019-06-24
NMS Tier 2|JJC|iPath Series B Bloomberg Copper Subindex Total ReturnSM ETN|De Minimis Firms|1523|9|2019-06-24
NMS Tier 2|JJG|iPath Series B Bloomberg Grains Subindex Total ReturnSM ETN|De Minimis Firms|4872|37|2019-06-24
NMS Tier 2|JJN|iPath Series B Bloomberg Nickel Subindex Total ReturnSM ETN|De Minimis Firms|1552|9|2019-06-24
NMS Tier 2|JJS|iPath Series B Bloomberg Softs Subindex Total ReturnSM ETN|De Minimis Firms|2429|5|2019-06-24
NMS Tier 2|JJSF|J & J Snack Foods Corp. Common Stock|De Minimis Firms|32416|764|2019-06-24
NMS Tier 2|JJU|iPath Series B Bloomberg Aluminum Subindex Total ReturnSM ETN|De Minimis Firms|11|3|2019-06-24
NMS Tier 2|JKF|iShares Morningstar Large-Cap Value ETF|De Minimis Firms|30426|229|2019-06-24
NMS Tier 2|JKG|iShares Morningstar Mid-Cap ETF|De Minimis Firms|11599|299|2019-06-24
NMS Tier 2|JKH|iShares Morningstar Mid-Cap Growth ETF|De Minimis Firms|25805|385|2019-06-24
NMS Tier 2|JKI|iShares Morningstar Mid-Cap Value ETF|De Minimis Firms|16594|340|2019-06-24
NMS Tier 2|JKJ|iShares Morningstar Small-Cap ETF|De Minimis Firms|4805|93|2019-06-24
NMS Tier 2|JKK|iShares Morningstar Small-Cap Growth ETF|De Minimis Firms|4163|117|2019-06-24
NMS Tier 2|JKL|iShares Morningstar Small-Cap Value ETF|De Minimis Firms|13323|254|2019-06-24
NMS Tier 2|JKS|JINKOSOLAR HOLDINGS CO|CITADEL SECURITIES LLC|456125|1100|2019-06-24
NMS Tier 2|JKS|JINKOSOLAR HOLDINGS CO|De Minimis Firms|505426|1336|2019-06-24
NMS Tier 2|JLS|Nuveen Mortgage Opportunity Term Fund|De Minimis Firms|63301|195|2019-06-24
NMS Tier 2|JMBS|Janus Henderson Mortgage-Backed Securities ETF|De Minimis Firms|69519|120|2019-06-24
NMS Tier 2|JMEI|JUMEI INTERNATIONAL HOLDING LIMITED|De Minimis Firms|632634|700|2019-06-24
NMS Tier 2|JMF|NUVEEN ENERGY MLP TOTAL RETURN FUND|De Minimis Firms|223979|651|2019-06-24
NMS Tier 2|JMIA|Jumia Technologies AG|CITADEL SECURITIES LLC|1856712|4730|2019-06-24
NMS Tier 2|JMIA|Jumia Technologies AG|De Minimis Firms|276110|1630|2019-06-24
NMS Tier 2|JMIA|Jumia Technologies AG|G1 EXECUTION SERVICES, LLC|637703|1406|2019-06-24
NMS Tier 2|JMIA|Jumia Technologies AG|TWO SIGMA SECURITIES, LLC|173514|1133|2019-06-24
NMS Tier 2|JMIA|Jumia Technologies AG|VIRTU AMERICAS LLC|1320655|3706|2019-06-24
NMS Tier 2|JMIA|Jumia Technologies AG|WOLVERINE SECURITIES, LLC|76007|1323|2019-06-24
NMS Tier 2|JMIN|JPMorgan U.S. Minimum Volatility ETF|De Minimis Firms|306474|89|2019-06-24
NMS Tier 2|JMLP|NUVEEN ALL CAP ENERGY MLP OPPORTUNITIES FUND|De Minimis Firms|96077|184|2019-06-24
NMS Tier 2|JMM|NUVEEN MULTI-MARKET INCOME FUND, INC|De Minimis Firms|36799|40|2019-06-24
NMS Tier 2|JMOM|JPMorgan U.S. Momentum Factor ETF|De Minimis Firms|7555|22|2019-06-24
NMS Tier 2|JMP|JMP Group LLC|De Minimis Firms|85026|154|2019-06-24
NMS Tier 2|JMPB|JMP Group Inc. 8.00% Senior Notes due 2023|De Minimis Firms|7830|26|2019-06-24
NMS Tier 2|JMPD|JMP Group Inc. 7.25% Senior Notes due 2027|De Minimis Firms|10096|59|2019-06-24
NMS Tier 2|JMST|JPMorgan Ultra-Short Municipal Income ETF|De Minimis Firms|15035|45|2019-06-24
NMS Tier 2|JMT|Nuveen Mortgage Opportunity Term Fund 2|De Minimis Firms|25814|76|2019-06-24
NMS Tier 2|JMU|JMU Limited ADS|CITADEL SECURITIES LLC|2027506|3805|2019-06-24
NMS Tier 2|JMU|JMU Limited ADS|De Minimis Firms|1136589|2127|2019-06-24
NMS Tier 2|JMU|JMU Limited ADS|VIRTU AMERICAS LLC|1467618|3241|2019-06-24
NMS Tier 2|JMUB|JPMorgan Municipal ETF|De Minimis Firms|1470|7|2019-06-24
NMS Tier 2|JNCE|Jounce Therapeutics, Inc. Common Stock|De Minimis Firms|104957|322|2019-06-24
NMS Tier 2|JNUG|Direxion Daily Junior Gold Miners Index Bull 3X Shares|CITADEL SECURITIES LLC|13600706|11725|2019-06-24
NMS Tier 2|JNUG|Direxion Daily Junior Gold Miners Index Bull 3X Shares|De Minimis Firms|1154848|914|2019-06-24
NMS Tier 2|JNUG|Direxion Daily Junior Gold Miners Index Bull 3X Shares|G1 EXECUTION SERVICES, LLC|4492117|1932|2019-06-24
NMS Tier 2|JNUG|Direxion Daily Junior Gold Miners Index Bull 3X Shares|TWO SIGMA SECURITIES, LLC|1512418|1642|2019-06-24
NMS Tier 2|JNUG|Direxion Daily Junior Gold Miners Index Bull 3X Shares|VIRTU AMERICAS LLC|6415758|5413|2019-06-24
