tierDescription|issueSymbolIdentifier|issueName|marketParticipantName|totalWeeklyShareQuantity|totalWeeklyTradeCount|lastUpdateDate
NMS Tier 2|QDYN|FlexShares Quality Dividend Dynamic Index Fund|De Minimis Firms|1404|7|2019-06-24
NMS Tier 2|QED|IQ Hedge Event-Driven Tracker ETF|De Minimis Firms|945|17|2019-06-24
NMS Tier 2|QEFA|SPDR MSCI EAFE StrategicFactors ETF|De Minimis Firms|83783|390|2019-06-24
NMS Tier 2|QEMM|SPDR MSCI Emerging Markets StrategicFactors ETF|De Minimis Firms|68665|242|2019-06-24
NMS Tier 2|QES|Quintana Energy Services Inc.|De Minimis Firms|81552|142|2019-06-24
NMS Tier 2|QFIN|360 Finance, Inc. American Depositary Shares|De Minimis Firms|94187|617|2019-06-24
NMS Tier 2|QGRO|American Century STOXX� U.S. Quality Growth ETF|De Minimis Firms|16367|47|2019-06-24
NMS Tier 2|QGTA|IQ Leaders GTAA Tracker ETF|De Minimis Firms|370|3|2019-06-24
NMS Tier 2|QHC|Quorum Health Corporation|De Minimis Firms|547827|871|2019-06-24
NMS Tier 2|QID|ProShares UltraShort QQQ|CITADEL SECURITIES LLC|2233182|2335|2019-06-24
NMS Tier 2|QID|ProShares UltraShort QQQ|De Minimis Firms|1923221|1926|2019-06-24
NMS Tier 2|QID|ProShares UltraShort QQQ|VIRTU AMERICAS LLC|1664508|1598|2019-06-24
NMS Tier 2|QINT|American Century Quality Diversified International ETF|De Minimis Firms|5728|16|2019-06-24
NMS Tier 2|QIWI|QIWI plc American Depositary Shares|CITADEL SECURITIES LLC|200994|1029|2019-06-24
NMS Tier 2|QIWI|QIWI plc American Depositary Shares|De Minimis Firms|232071|644|2019-06-24
NMS Tier 2|QLC|FlexShares Trust FlexShares US Quality Large Cap Index Fund|De Minimis Firms|591622|41|2019-06-24
NMS Tier 2|QLD|ProShares Ultra QQQ|CITADEL SECURITIES LLC|769365|2386|2019-06-24
NMS Tier 2|QLD|ProShares Ultra QQQ|De Minimis Firms|844969|1697|2019-06-24
NMS Tier 2|QLD|ProShares Ultra QQQ|VIRTU AMERICAS LLC|492543|1089|2019-06-24
NMS Tier 2|QLS|IQ Hedge Long/Short Tracker ETF|De Minimis Firms|636|1|2019-06-24
NMS Tier 2|QLTA|iShares Aaa - A Rated Corporate Bond ETF|De Minimis Firms|161182|285|2019-06-24
NMS Tier 2|QLYS|Qualys, Inc. Common Stock|De Minimis Firms|204406|1866|2019-06-24
NMS Tier 2|QMN|IQ Hedge Market Neutral Tracker ETF|De Minimis Firms|2921|37|2019-06-24
NMS Tier 2|QMOM|Alpha Architect U.S. Quantitative Momentum ETF|De Minimis Firms|3805|16|2019-06-24
NMS Tier 2|QNST|QuinStreet, Inc. Common Stock|De Minimis Firms|412556|1979|2019-06-24
NMS Tier 2|QQQE|Direxion NASDAQ-100 Equal Weighted Index Shares|De Minimis Firms|99027|487|2019-06-24
NMS Tier 2|QQQX|Nuveen NASDAQ 100 Dynamic Overwrite Fund Shares of Beneficial Interest|De Minimis Firms|217343|750|2019-06-24
NMS Tier 2|QQXT|First Trust NASDAQ-100 Ex-Technology Sector Index Fund|De Minimis Firms|17977|93|2019-06-24
NMS Tier 2|QRFT|Qraft AI-Enhanced US Large Cap ETF|De Minimis Firms|100675|14|2019-06-24
NMS Tier 2|QRHC|Quest Resource Holding Corporation Common Stock|De Minimis Firms|182847|529|2019-06-24
NMS Tier 2|QRTEB|Qurate Retail, Inc. Series B Common Stock|De Minimis Firms|917|18|2019-06-24
NMS Tier 2|QSR|Restaurant Brands International Inc.|CITADEL SECURITIES LLC|229372|1965|2019-06-24
NMS Tier 2|QSR|Restaurant Brands International Inc.|De Minimis Firms|3134854|2247|2019-06-24
NMS Tier 2|QSY|WisdomTree U.S. Quality Shareholder Yield Fund|De Minimis Firms|958|20|2019-06-24
NMS Tier 2|QTNA|Quantenna Communications, Inc. Common Stock|De Minimis Firms|1386033|1417|2019-06-24
NMS Tier 2|QTNT|Quotient Limited Ordinary Shares|De Minimis Firms|294887|691|2019-06-24
NMS Tier 2|QTRH|Quarterhill Inc. Common Shares|De Minimis Firms|79048|68|2019-06-24
NMS Tier 2|QTRX|Quanterix Corporation Common Stock|De Minimis Firms|90251|416|2019-06-24
NMS Tier 2|QTS|QTS REALTY TRUST, INC.|De Minimis Firms|277198|962|2019-06-24
NMS Tier 2|QTS$A|QTS Realty Trust, Inc. 7.125% Series A Cumulative Redeemable Perpetual Preferred Stock|De Minimis Firms|15772|55|2019-06-24
NMS Tier 2|QTS$B|QTS Realty Trust, Inc. 6.50% Series B Cumulative Convertible Perpetual Preferred Stock|De Minimis Firms|976|7|2019-06-24
NMS Tier 2|QTT|Qutoutiao Inc. American Depositary Shares|CITADEL SECURITIES LLC|1255514|2489|2019-06-24
NMS Tier 2|QTT|Qutoutiao Inc. American Depositary Shares|De Minimis Firms|925421|2011|2019-06-24
NMS Tier 2|QTT|Qutoutiao Inc. American Depositary Shares|G1 EXECUTION SERVICES, LLC|497010|1109|2019-06-24
NMS Tier 2|QTUM|Defiance Quantum ETF|De Minimis Firms|3142|53|2019-06-24
NMS Tier 2|QTWO|Q2 Holdings Inc|De Minimis Firms|187914|808|2019-06-24
NMS Tier 2|QUAD|QUAD/GRAPHICS, INC.|De Minimis Firms|360148|1058|2019-06-24
NMS Tier 2|QUIK|QuickLogic Corporation Common Stock|De Minimis Firms|324956|338|2019-06-24
NMS Tier 2|QUMU|Qumu Corporation Common Stock|De Minimis Firms|255208|480|2019-06-24
NMS Tier 2|QUOT|Quotient Technology Inc|De Minimis Firms|293574|619|2019-06-24
NMS Tier 2|QURE|uniQure N.V. Ordinary Shares|De Minimis Firms|343942|1634|2019-06-24
NMS Tier 2|QUS|SPDR MSCI USA StrategicFactors ETF|De Minimis Firms|120883|403|2019-06-24
NMS Tier 2|QVAL|Alpha Architect U.S. Quantitative Value ETF|De Minimis Firms|39511|106|2019-06-24
NMS Tier 2|QVCD|QVC, Inc. 6.375% Senior Secured Notes due 2067|De Minimis Firms|83976|177|2019-06-24
NMS Tier 2|QVM|Arrow QVM Equity Factor ETF|De Minimis Firms|55|2|2019-06-24
NMS Tier 2|QWLD|SPDR MSCI World StrategicFactors ETF|De Minimis Firms|6761|88|2019-06-24
NMS Tier 2|RA|Brookfield Real Assets Income Fund Inc.|De Minimis Firms|229963|913|2019-06-24
NMS Tier 2|RAAX|VanEck Vectors Real Asset Allocation ETF|De Minimis Firms|49671|28|2019-06-24
NMS Tier 2|RACE|Ferrari N.V.|De Minimis Firms|997973|1811|2019-06-24
NMS Tier 2|RAD|Rite Aid Corporation|CITADEL SECURITIES LLC|1207990|2397|2019-06-24
NMS Tier 2|RAD|Rite Aid Corporation|De Minimis Firms|775498|1832|2019-06-24
NMS Tier 2|RAD|Rite Aid Corporation|VIRTU AMERICAS LLC|588344|1165|2019-06-24
NMS Tier 2|RADA|RADA Electronic Industries Ltd. Ordinary Shares|De Minimis Firms|395451|809|2019-06-24
NMS Tier 2|RAIL|FreightCar America, Inc. Common Stock|De Minimis Firms|71908|300|2019-06-24
NMS Tier 2|RALS|ProShares RAFI Long/Short|De Minimis Firms|1725|12|2019-06-24
NMS Tier 2|RAMP|LiveRamp Holdings, Inc. Common Stock|De Minimis Firms|152503|763|2019-06-24
NMS Tier 2|RAND|Rand Capital Corporation Common Stock ($0.10 Par Value)|De Minimis Firms|29123|66|2019-06-24
NMS Tier 2|RARE|Ultragenyx Pharmaceutical Inc. Common Stock|De Minimis Firms|186711|1286|2019-06-24
NMS Tier 2|RARX|Ra Pharmaceuticals, Inc. Common Stock|De Minimis Firms|176730|883|2019-06-24
NMS Tier 2|RAVE|Rave Restaurant Group, Inc. Common Stock|De Minimis Firms|823363|2440|2019-06-24
NMS Tier 2|RAVN|Raven Industries, Inc. Common Stock|De Minimis Firms|264627|413|2019-06-24
NMS Tier 2|RBA|Ritchie Bros. Auctioneers Incorporated|De Minimis Firms|163066|1533|2019-06-24
NMS Tier 2|RBB|RBB Bancorp Common Stock|De Minimis Firms|13423|102|2019-06-24
NMS Tier 2|RBBN|Ribbon Communications Inc. Common Stock|De Minimis Firms|662712|436|2019-06-24
NMS Tier 2|RBCAA|Republic Bancorp, Inc. Class A Common Stock|De Minimis Firms|33135|244|2019-06-24
NMS Tier 2|RBCN|Rubicon Technology, Inc. Common Stock|De Minimis Firms|10531|41|2019-06-24
NMS Tier 2|RBKB|Rhinebeck Bancorp, Inc. Common Stock|De Minimis Firms|37957|102|2019-06-24
NMS Tier 2|RBNC|Reliant Bancorp, Inc. Common Stock|De Minimis Firms|4868|51|2019-06-24
NMS Tier 2|RBS|THE ROYAL BANK OF SCOTLAND GROUP PLC|De Minimis Firms|528346|1202|2019-06-24
NMS Tier 2|RBZ|Reebonz Holding Limited Ordinary Shares|CITADEL SECURITIES LLC|441071|1400|2019-06-24
NMS Tier 2|RBZ|Reebonz Holding Limited Ordinary Shares|De Minimis Firms|356912|920|2019-06-24
NMS Tier 2|RBZ|Reebonz Holding Limited Ordinary Shares|G1 EXECUTION SERVICES, LLC|202643|1049|2019-06-24
NMS Tier 2|RBZ|Reebonz Holding Limited Ordinary Shares|WOLVERINE SECURITIES, LLC|192322|1601|2019-06-24
NMS Tier 2|RC|Ready Capital Corporation|De Minimis Firms|599863|475|2019-06-24
NMS Tier 2|RCA|Ready Capital Corporation 7.00% Convertible Senior Notes due 2023|De Minimis Firms|3089|15|2019-06-24
NMS Tier 2|RCD|Invesco S&P 500 Equal Weight Consumer Discretionary ETF|De Minimis Firms|51558|192|2019-06-24
NMS Tier 2|RCG|RENN Fund Inc.|De Minimis Firms|34380|16|2019-06-24
NMS Tier 2|RCI|Rogers Communications, Inc.|De Minimis Firms|427935|1442|2019-06-24
NMS Tier 2|RCII|Rent-A-Center Inc. Common Stock|De Minimis Firms|1551578|1352|2019-06-24
NMS Tier 2|RCKT|Rocket Pharmaceuticals, Inc. Common Stock|De Minimis Firms|339606|705|2019-06-24
NMS Tier 2|RCKY|Rocky Brands, Inc. Common Stock|De Minimis Firms|62184|225|2019-06-24
NMS Tier 2|RCM|R1 RCM Inc. Common Stock|De Minimis Firms|1650925|1347|2019-06-24
NMS Tier 2|RCMT|RCM Technologies, Inc. Common Stock|De Minimis Firms|22305|55|2019-06-24
NMS Tier 2|RCON|Recon Technology, Ltd. Ordinary Shares|De Minimis Firms|36813|219|2019-06-24
NMS Tier 2|RCP|Ready Capital Corporation 6.50% Senior Notes due 2021|De Minimis Firms|8245|59|2019-06-24
NMS Tier 2|RCS|PIMCO STRATEGIC INCOME FUND, INC.|De Minimis Firms|214758|468|2019-06-24
NMS Tier 2|RCUS|Arcus Biosciences, Inc.|De Minimis Firms|67669|215|2019-06-24
NMS Tier 2|RDCM|Radcom Ltd. Ordinary Shares|De Minimis Firms|5555|24|2019-06-24
NMS Tier 2|RDFN|Redfin Corporation Common Stock|CITADEL SECURITIES LLC|236899|1235|2019-06-24
NMS Tier 2|RDFN|Redfin Corporation Common Stock|De Minimis Firms|308071|1308|2019-06-24
NMS Tier 2|RDHL|Redhill Biopharma Ltd. American Depositary Shares|De Minimis Firms|41761|114|2019-06-24
NMS Tier 2|RDI|Reading International Inc Class A Common Stock|De Minimis Firms|25872|173|2019-06-24
NMS Tier 2|RDIB|Reading International Inc Class B Common Stock|De Minimis Firms|25|2|2019-06-24
NMS Tier 2|RDN|Radian Group Inc.|De Minimis Firms|562760|1414|2019-06-24
NMS Tier 2|RDNT|RadNet, Inc. Common Stock|De Minimis Firms|678787|630|2019-06-24
NMS Tier 2|RDS.A|Royal Dutch Shell PLC ADS Class A|CITADEL SECURITIES LLC|685554|3947|2019-06-24
NMS Tier 2|RDS.A|Royal Dutch Shell PLC ADS Class A|De Minimis Firms|1005269|2331|2019-06-24
NMS Tier 2|RDS.A|Royal Dutch Shell PLC ADS Class A|G1 EXECUTION SERVICES, LLC|383869|2174|2019-06-24
NMS Tier 2|RDS.A|Royal Dutch Shell PLC ADS Class A|VIRTU AMERICAS LLC|467949|2222|2019-06-24
NMS Tier 2|RDS.B|Royal Dutch Shell PLC ADS Class B|CITADEL SECURITIES LLC|565074|3773|2019-06-24
NMS Tier 2|RDS.B|Royal Dutch Shell PLC ADS Class B|De Minimis Firms|144969|1288|2019-06-24
NMS Tier 2|RDS.B|Royal Dutch Shell PLC ADS Class B|G1 EXECUTION SERVICES, LLC|251805|1140|2019-06-24
NMS Tier 2|RDS.B|Royal Dutch Shell PLC ADS Class B|VIRTU AMERICAS LLC|312637|1932|2019-06-24
NMS Tier 2|RDUS|Radius Health, Inc. Common Stock|De Minimis Firms|274795|873|2019-06-24
NMS Tier 2|RDVT|Red Violet, Inc. Common Stock|De Minimis Firms|169671|659|2019-06-24
NMS Tier 2|RDWR|Radware Ltd. Ordinary Shares|De Minimis Firms|64610|395|2019-06-24
NMS Tier 2|RDY|Dr. Reddy's Laboratories Limited American Depositary Shares|De Minimis Firms|108986|766|2019-06-24
NMS Tier 2|RECN|Resources Connection, Inc. Common Stock|De Minimis Firms|45411|298|2019-06-24
NMS Tier 2|REDU|RISE Education Cayman Ltd American Depositary Shares|De Minimis Firms|25904|190|2019-06-24
NMS Tier 2|REDV|Oppenheimer Emerging Markets Ultra Dividend Revenue ETF|De Minimis Firms|111|1|2019-06-24
NMS Tier 2|REED|Reeds, Inc. Common Stock|De Minimis Firms|156530|327|2019-06-24
NMS Tier 2|REEM|Oppenheimer Emerging Markets Revenue ETF|De Minimis Firms|325|3|2019-06-24
NMS Tier 2|REFA|Oppenheimer International Revenue ETF|De Minimis Firms|1004|6|2019-06-24
NMS Tier 2|REFR|Research Frontiers Incorporated Common Stock|De Minimis Firms|239562|648|2019-06-24
NMS Tier 2|REGI|Renewable Energy Group, Inc. Common Stock|CITADEL SECURITIES LLC|255858|1704|2019-06-24
NMS Tier 2|REGI|Renewable Energy Group, Inc. Common Stock|De Minimis Firms|527445|1012|2019-06-24
NMS Tier 2|REGL|ProShares S&P MidCap 400 Dividend Aristocrats ETF|De Minimis Firms|106348|645|2019-06-24
NMS Tier 2|REI|Ring Energy Inc.|De Minimis Firms|683350|1509|2019-06-24
NMS Tier 2|REK|ProShares Short Real Estate|De Minimis Firms|11013|48|2019-06-24
NMS Tier 2|REKR|Rekor Systems, Inc. Common Stock|De Minimis Firms|361212|438|2019-06-24
NMS Tier 2|RELL|Richardson Electronics, Ltd. Common Stock|De Minimis Firms|87797|293|2019-06-24
NMS Tier 2|RELV|Reliv' International, Inc. Common Stock|De Minimis Firms|8940|28|2019-06-24
NMS Tier 2|RELX|RELX PLC|De Minimis Firms|455472|1584|2019-06-24
NMS Tier 2|REML|Credit Suisse X-Links Monthly Pay 2xLeveraged Mortgage REIT ETN|De Minimis Firms|189591|596|2019-06-24
NMS Tier 2|REMX|VanEck Vectors Rare Earth/Strategic Metals ETF|CITADEL SECURITIES LLC|1412682|3971|2019-06-24
NMS Tier 2|REMX|VanEck Vectors Rare Earth/Strategic Metals ETF|De Minimis Firms|1758144|2966|2019-06-24
NMS Tier 2|REMX|VanEck Vectors Rare Earth/Strategic Metals ETF|JANE STREET CAPITAL, LLC|766563|1639|2019-06-24
NMS Tier 2|REMX|VanEck Vectors Rare Earth/Strategic Metals ETF|VIRTU AMERICAS LLC|937229|1966|2019-06-24
NMS Tier 2|RENN|Renren Inc. American Depositary Shares (each representing fifteen Class A ordinary shares)|De Minimis Firms|356344|630|2019-06-24
NMS Tier 2|REPH|Recro Pharma, Inc. Common Stock|De Minimis Firms|123061|796|2019-06-24
NMS Tier 2|REPL|Replimune Group, Inc. Common Stock|De Minimis Firms|10859|113|2019-06-24
NMS Tier 2|RESI|Front Yard Residential Corporation Common Stock|De Minimis Firms|447260|1218|2019-06-24
NMS Tier 2|RESN|Resonant Inc. Common Stock|De Minimis Firms|185714|295|2019-06-24
NMS Tier 2|RETA|Reata Pharmaceuticals, Inc. Class A Common Stock|De Minimis Firms|72941|640|2019-06-24
NMS Tier 2|RETL|Direxion Daily Retail Bull 3X Shares|De Minimis Firms|18036|150|2019-06-24
NMS Tier 2|RETO|ReTo Eco-Solutions, Inc. Common Shares|De Minimis Firms|3014|9|2019-06-24
NMS Tier 2|REV|Revlon, Inc.|De Minimis Firms|83398|487|2019-06-24
NMS Tier 2|REVG|REV Group, Inc.|De Minimis Firms|68647|360|2019-06-24
NMS Tier 2|REW|Proshares UltraShort Technology|De Minimis Firms|49285|166|2019-06-24
NMS Tier 2|REX|REX American Resources Corp.|De Minimis Firms|23557|259|2019-06-24
NMS Tier 2|REXR|REXFORD INDUSTRIAL REALTY, INC.|De Minimis Firms|2044143|1030|2019-06-24
NMS Tier 2|REXR$A|Rexford Industrial Realty, Inc 5.875% Series A Cumulative Redeemable Preferred Stock|De Minimis Firms|21203|15|2019-06-24
NMS Tier 2|REXR$B|Rexford Industrial Realty, Inc. 5.875% Series B Cumulative Redeemable Preferred Stock|De Minimis Firms|13000|5|2019-06-24
NMS Tier 2|REZ|iShares Residential Real Estate ETF|De Minimis Firms|53423|544|2019-06-24
NMS Tier 2|RF$A|REGIONS FINANCIAL CORPORATION Depositary Shares Each Representing a 1/40th Interest in a Share of 6.|De Minimis Firms|39752|179|2019-06-24
NMS Tier 2|RF$B|REGIONS FINANCIAL CORPORATION|De Minimis Firms|61358|588|2019-06-24
NMS Tier 2|RF$C|Regions Financial Corporation Depositary Shares, each Representing a 1/40th Interest in a Share of 5|De Minimis Firms|162628|352|2019-06-24
NMS Tier 2|RFAP|First Trust Exchange-Traded Fund III First Trust RiverFront Dynamic Asia Pacific ETF|De Minimis Firms|2282|36|2019-06-24
NMS Tier 2|RFCI|RiverFront Dynamic Core Income|De Minimis Firms|21029|38|2019-06-24
NMS Tier 2|RFDA|RiverFront Dynamic US Dividend Advantage ETF|De Minimis Firms|20852|61|2019-06-24
NMS Tier 2|RFEM|First Trust Exchange-Traded Fund III First Trust RiverFront Dynamic Emerging Markets ETF|De Minimis Firms|18202|151|2019-06-24
NMS Tier 2|RFEU|First Trust Exchange-Traded Fund III First Trust RiverFront Dynamic Europe ETF|De Minimis Firms|6583|69|2019-06-24
NMS Tier 2|RFFC|RiverFront Dynamic US Flex-Cap ETF|De Minimis Firms|24279|87|2019-06-24
NMS Tier 2|RFG|Invesco S&P MidCap 400 Pure Growth ETF|De Minimis Firms|12945|213|2019-06-24
NMS Tier 2|RFI|Cohen and Steers Total Return Realty Fund|De Minimis Firms|289438|696|2019-06-24
NMS Tier 2|RFIL|RF Industries, Ltd. Common Stock|De Minimis Firms|60895|209|2019-06-24
NMS Tier 2|RFL|Rafael Holdings, Inc.|De Minimis Firms|45372|240|2019-06-24
NMS Tier 2|RFP|Resolute Forest Products Inc.|De Minimis Firms|663865|864|2019-06-24
NMS Tier 2|RFUN|RiverFront Dynamic Unconstrained Income|De Minimis Firms|1643|18|2019-06-24
NMS Tier 2|RFV|Invesco S&P MidCap 400 Pure Value ETF|De Minimis Firms|15038|109|2019-06-24
NMS Tier 2|RGCO|RGC Resources Inc. Common Stock|De Minimis Firms|7143|94|2019-06-24
NMS Tier 2|RGEN|Repligen Corporation Common Stock|De Minimis Firms|213377|1160|2019-06-24
NMS Tier 2|RGLS|Regulus Therapeutics Inc. Common Stock|De Minimis Firms|914239|1083|2019-06-24
NMS Tier 2|RGNX|REGENXBIO Inc. Common Stock|CITADEL SECURITIES LLC|317430|1691|2019-06-24
NMS Tier 2|RGNX|REGENXBIO Inc. Common Stock|De Minimis Firms|437454|1617|2019-06-24
NMS Tier 2|RGR|Sturm, Ruger & Company, Inc.|De Minimis Firms|103875|850|2019-06-24
NMS Tier 2|RGS|Regis Corporation|De Minimis Firms|186846|309|2019-06-24
NMS Tier 2|RGT|Royce Global Value Trust, Inc.|De Minimis Firms|26693|118|2019-06-24
NMS Tier 2|RH|RH|CITADEL SECURITIES LLC|187050|1327|2019-06-24
NMS Tier 2|RH|RH|De Minimis Firms|394634|1790|2019-06-24
NMS Tier 2|RHE|Regional Health Properties, Inc.|De Minimis Firms|386958|1178|2019-06-24
NMS Tier 2|RHE$A|Regional Health Properties, Inc. Regional Health Properties, Inc. 10.875 percent Series A Cumulative|De Minimis Firms|6658|22|2019-06-24
NMS Tier 2|RHP|Ryman Hospitality Properties, Inc|De Minimis Firms|171117|1333|2019-06-24
NMS Tier 2|RIBT|RiceBran Technologies Common Stock|De Minimis Firms|102242|184|2019-06-24
NMS Tier 2|RICK|RCI Hospitality Holdings, Inc. Common Stock|De Minimis Firms|135103|692|2019-06-24
NMS Tier 2|RIF|RMR Real Estate Income Fund|De Minimis Firms|52152|305|2019-06-24
NMS Tier 2|RIGL|Rigel Pharmaceuticals, Inc. Common Stock|De Minimis Firms|2874290|2337|2019-06-24
NMS Tier 2|RIGS|RiverFront Strategic Income Fund|De Minimis Firms|66573|219|2019-06-24
NMS Tier 2|RILY|B. Riley Financial, Inc. Common Stock|De Minimis Firms|32696|221|2019-06-24
NMS Tier 2|RILYG|B. Riley Financial, Inc. 7.25% Senior Notes due 2027|De Minimis Firms|22617|64|2019-06-24
NMS Tier 2|RILYH|B. Riley Financial, Inc. 7.375% Senior Notes due 2023|De Minimis Firms|16960|73|2019-06-24
NMS Tier 2|RILYI|B. Riley Financial, Inc. 6.875% Senior Notes due 2023|De Minimis Firms|3293|16|2019-06-24
NMS Tier 2|RILYL|B. Riley Financial, Inc. 7.50% Senior Notes|De Minimis Firms|15274|38|2019-06-24
NMS Tier 2|RILYO|B. Riley Financial, Inc. 6.75% Senior Notes due 2024|De Minimis Firms|29707|113|2019-06-24
NMS Tier 2|RILYZ|B. Riley Financial, Inc. 7.50% Senior Notes Due 2027|De Minimis Firms|25163|79|2019-06-24
NMS Tier 2|RINF|ProShares Inflation Expectations ETF|De Minimis Firms|1645|13|2019-06-24
NMS Tier 2|RIO|Rio Tinto plc|CITADEL SECURITIES LLC|491859|2009|2019-06-24
NMS Tier 2|RIO|Rio Tinto plc|De Minimis Firms|717035|2046|2019-06-24
NMS Tier 2|RIOT|Riot Blockchain, Inc.  Common Stock|CITADEL SECURITIES LLC|868215|1991|2019-06-24
NMS Tier 2|RIOT|Riot Blockchain, Inc.  Common Stock|De Minimis Firms|527320|1020|2019-06-24
NMS Tier 2|RIOT|Riot Blockchain, Inc.  Common Stock|VIRTU AMERICAS LLC|532368|1080|2019-06-24
NMS Tier 2|RIOT|Riot Blockchain, Inc.  Common Stock|WOLVERINE SECURITIES, LLC|344825|2137|2019-06-24
NMS Tier 2|RISE|Sit Rising Rate ETF|De Minimis Firms|1158|13|2019-06-24
NMS Tier 2|RIV|RiverNorth Opportunities Fund, Inc. Common Stock|De Minimis Firms|77257|216|2019-06-24
NMS Tier 2|RIVE|Riverview Financial Corporation Common Stock|De Minimis Firms|6132|8|2019-06-24
NMS Tier 2|RJA|AB Svensk Ekportkredit ELEMENTS Linked to the Rogers International Commodity Index-Agriculture Total|De Minimis Firms|73085|88|2019-06-24
NMS Tier 2|RJI|AB Svensk Ekportkredit ELEMENTS Linked to the Rogers International Commodity Index-Total Return|De Minimis Firms|167478|190|2019-06-24
NMS Tier 2|RJN|AB Svensk Ekportkredit ELEMENTS Linked to the Rogers International Commodity Index-Energy Total Retu|De Minimis Firms|32402|18|2019-06-24
NMS Tier 2|RJZ|AB Svensk Ekportkredit ELEMENTS Linked to the Rogers International Commodity Index-Metals Total Retu|De Minimis Firms|702|3|2019-06-24
NMS Tier 2|RKDA|Arcadia Biosciences, Inc. Common Stock|De Minimis Firms|122534|463|2019-06-24
NMS Tier 2|RLGT|Radiant Logistics, Inc.|De Minimis Firms|555084|1290|2019-06-24
NMS Tier 2|RLH|Red Lions Hotel Corporation|De Minimis Firms|61180|244|2019-06-24
NMS Tier 2|RLI|RLI Corp.|De Minimis Firms|67715|709|2019-06-24
NMS Tier 2|RLJ|RLJ Lodging Trust|De Minimis Firms|396517|1069|2019-06-24
NMS Tier 2|RLJ$A|RLJ Lodging Trust $1.95 Series A Cumulative Convertible Preferred Shares|De Minimis Firms|57562|246|2019-06-24
NMS Tier 2|RLM|Realm Therapeutics plc American Depositary Shares|De Minimis Firms|40501|101|2019-06-24
NMS Tier 2|RLY|SPDR SSgA Multi-Asset Real Return ETF of SSgA Active Trust|De Minimis Firms|46292|169|2019-06-24
NMS Tier 2|RM|REGIONAL MANAGEMENT CORP|De Minimis Firms|12503|120|2019-06-24
NMS Tier 2|RMAX|RE/MAX HOLDINGS, INC.|De Minimis Firms|119019|907|2019-06-24
NMS Tier 2|RMBL|RumbleOn, Inc. Class B Common Stock|De Minimis Firms|41136|196|2019-06-24
NMS Tier 2|RMBS|Rambus Inc. Common Stock|De Minimis Firms|1175161|857|2019-06-24
NMS Tier 2|RMCF|Rocky Mountain Chocolate Factory, Inc. Common Stock|De Minimis Firms|9654|72|2019-06-24
NMS Tier 2|RMED|Ra Medical Systems, Inc|De Minimis Firms|83460|195|2019-06-24
NMS Tier 2|RMG|RMG Acquisition Corp. Class A Common Stock|De Minimis Firms|125101|3|2019-06-24
NMS Tier 2|RMI|RiverNorth Opportunistic Municipal Income Fund, Inc. Common Stock|De Minimis Firms|68954|89|2019-06-24
NMS Tier 2|RMNI|Rimini Street, Inc. (DE) Common Stock|De Minimis Firms|55678|266|2019-06-24
NMS Tier 2|RMPL$|RiverNorth Marketplace Lending Corporation 5.875 Percent Series A Term Preferred Stock Due 2024|De Minimis Firms|4309|33|2019-06-24
NMS Tier 2|RMR|The RMR Group Inc. Class A Common Stock|De Minimis Firms|359730|658|2019-06-24
NMS Tier 2|RMT|Royce Micro-Cap Trust Inc|De Minimis Firms|294665|664|2019-06-24
NMS Tier 2|RMTI|Rockwell Medical, Inc. Common Stock|De Minimis Firms|259211|752|2019-06-24
NMS Tier 2|RNDB|Randolph Bancorp, Inc. Common Stock|De Minimis Firms|22612|14|2019-06-24
NMS Tier 2|RNDM|First Trust Exchange-Traded Fund VI First Trust Developed International Equity Select ETF|De Minimis Firms|9314|57|2019-06-24
NMS Tier 2|RNDV|First Trust Exchange-Traded Fund VI First Trust US Equity Dividend Select ETF|De Minimis Firms|423|4|2019-06-24
NMS Tier 2|RNEM|First Trust Exchange-Traded Fund VI First Trust Emerging Markets Equity Select ETF|De Minimis Firms|4519|57|2019-06-24
NMS Tier 2|RNET|RigNet, Inc. Common Stock|De Minimis Firms|161571|813|2019-06-24
NMS Tier 2|RNGR|Ranger Energy Services, Inc.|De Minimis Firms|35458|101|2019-06-24
NMS Tier 2|RNLC|First Trust Exchange-Traded Fund VI First Trust Large Cap US Equity Select ETF|De Minimis Firms|11146|34|2019-06-24
NMS Tier 2|RNMC|First Trust Exchange-Traded Fund VI Mid Cap US Equity Select ETF|De Minimis Firms|13836|60|2019-06-24
NMS Tier 2|RNN|Rexahn Pharmaceuticals, Inc.|De Minimis Firms|66211|232|2019-06-24
NMS Tier 2|RNP|Cohen & Steers REIT and Preferred and Income Fund, Inc.|De Minimis Firms|325231|1356|2019-06-24
NMS Tier 2|RNR$C|RenaissanceRe Holdings Ltd. 6.08% Series C Preference Shares|De Minimis Firms|3052|16|2019-06-24
NMS Tier 2|RNR$E|RENAISSANCERE HOLDINGS LTD 5.375% SER E|De Minimis Firms|38012|285|2019-06-24
NMS Tier 2|RNR$F|RenaissanceRe Holdings Ltd. Depositary Shares, each Representing a 1/1,000th Interest in a 5.750% Se|De Minimis Firms|50153|292|2019-06-24
NMS Tier 2|RNSC|First Trust Exchange-Traded Fund VI First Trust Small Cap US Equity Select ETF|De Minimis Firms|5179|27|2019-06-24
NMS Tier 2|RNST|Renasant Corporation Common Stock|De Minimis Firms|65122|346|2019-06-24
NMS Tier 2|RNWK|RealNetworks, Inc. Common Stock|De Minimis Firms|15569|60|2019-06-24
NMS Tier 2|ROAD|Construction Partners, Inc. Class A Common Stock|De Minimis Firms|87290|393|2019-06-24
NMS Tier 2|ROAM|Hartford Multifactor Emerging Markets ETF|De Minimis Firms|21796|65|2019-06-24
NMS Tier 2|ROAN|Roan Resources, Inc.|De Minimis Firms|1347151|2225|2019-06-24
NMS Tier 2|ROBT|First Trust Exchange-Traded Fund VI First Trust Nasdaq Artificial Intelligence and Robotics ETF|De Minimis Firms|57558|202|2019-06-24
NMS Tier 2|ROCK|Gibraltar Industries, Inc. Common Stock|De Minimis Firms|46572|327|2019-06-24
NMS Tier 2|ROG|Rogers Corporation|CITADEL SECURITIES LLC|239512|1903|2019-06-24
NMS Tier 2|ROG|Rogers Corporation|De Minimis Firms|288477|2084|2019-06-24
NMS Tier 2|ROGS|Hartford Multifactor Global Small Cap ETF|De Minimis Firms|8099|28|2019-06-24
NMS Tier 2|ROIC|Retail Opportunity Investments Corp. Common Stock (MD)|De Minimis Firms|739063|880|2019-06-24
NMS Tier 2|ROKU|Roku, Inc. Class A Common Stock|ACS EXECUTION SERVICES, LLC|135526|1252|2019-06-24
NMS Tier 2|ROKU|Roku, Inc. Class A Common Stock|CITADEL SECURITIES LLC|15014714|43303|2019-06-24
NMS Tier 2|ROKU|Roku, Inc. Class A Common Stock|De Minimis Firms|1645741|1852|2019-06-24
NMS Tier 2|ROKU|Roku, Inc. Class A Common Stock|G1 EXECUTION SERVICES, LLC|6924940|17243|2019-06-24
NMS Tier 2|ROKU|Roku, Inc. Class A Common Stock|TWO SIGMA SECURITIES, LLC|1408279|3317|2019-06-24
NMS Tier 2|ROKU|Roku, Inc. Class A Common Stock|UBS SECURITIES, LLC|554992|1310|2019-06-24
NMS Tier 2|ROKU|Roku, Inc. Class A Common Stock|VIRTU AMERICAS LLC|9157600|20870|2019-06-24
NMS Tier 2|ROKU|Roku, Inc. Class A Common Stock|WOLVERINE SECURITIES, LLC|186647|2300|2019-06-24
NMS Tier 2|ROLL|RBC Bearings Incorporated Common Stock|De Minimis Firms|66653|1435|2019-06-24
NMS Tier 2|ROM|ProShares Ultra Technology|De Minimis Firms|158467|843|2019-06-24
NMS Tier 2|ROOF|IQ US REAL ESTATE SMALL CAP ETF|De Minimis Firms|45325|372|2019-06-24
NMS Tier 2|RORE|Hartford Multifactor REIT ETF|De Minimis Firms|2921|14|2019-06-24
NMS Tier 2|ROSE|Rosehill Resources Inc. Class A Common Stock|De Minimis Firms|117628|346|2019-06-24
NMS Tier 2|ROSEW|Rosehill Resources Inc. Warrants|De Minimis Firms|1200|3|2019-06-24
NMS Tier 2|ROUS|Hartford Multifactor US Equity ETF|De Minimis Firms|109771|265|2019-06-24
