tierDescription|issueSymbolIdentifier|issueName|marketParticipantName|totalWeeklyShareQuantity|totalWeeklyTradeCount|lastUpdateDate
NMS Tier 2|DDMXW|DD3 Acquisition Corp. Warrants|De Minimis Firms|1600|11|2019-06-24
NMS Tier 2|DDS|Dillards Inc.|De Minimis Firms|217716|1065|2019-06-24
NMS Tier 2|DDT|Dillard's Capital Trust I 7.50% Capital Securities|De Minimis Firms|15950|75|2019-06-24
NMS Tier 2|DDWM|WisdomTree Dynamic Currency Hedged International Equity Fund|De Minimis Firms|75585|180|2019-06-24
NMS Tier 2|DEA|Easterly Government Properties, Inc.|De Minimis Firms|217615|1000|2019-06-24
NMS Tier 2|DEACU|Diamond Eagle Acquisition Corp. Unit|De Minimis Firms|757687|11|2019-06-24
NMS Tier 2|DECK|Deckers Outdoor Corp|CITADEL SECURITIES LLC|183367|1325|2019-06-24
NMS Tier 2|DECK|Deckers Outdoor Corp|De Minimis Firms|597545|1874|2019-06-24
NMS Tier 2|DEEF|Xtrackers FTSE Developed ex US Comprehensive Factor ETF|De Minimis Firms|32023|86|2019-06-24
NMS Tier 2|DEF|Invesco Defensive Equity ETF|De Minimis Firms|30517|151|2019-06-24
NMS Tier 2|DEFA|iShares Adaptive Currency Hedged MSCI EAFE ETF|De Minimis Firms|877|6|2019-06-24
NMS Tier 2|DEMG|Xtrackers FTSE Emerging Comprehensive Factor ETF|De Minimis Firms|546|4|2019-06-24
NMS Tier 2|DENN|Denny's Corporation Common Stock|De Minimis Firms|185992|843|2019-06-24
NMS Tier 2|DEO|Diageo plc|CITADEL SECURITIES LLC|103523|2314|2019-06-24
NMS Tier 2|DEO|Diageo plc|De Minimis Firms|211166|2102|2019-06-24
NMS Tier 2|DEO|Diageo plc|VIRTU AMERICAS LLC|55928|1659|2019-06-24
NMS Tier 2|DERM|Dermira, Inc. Common Stock|CITADEL SECURITIES LLC|168259|1045|2019-06-24
NMS Tier 2|DERM|Dermira, Inc. Common Stock|De Minimis Firms|434783|716|2019-06-24
NMS Tier 2|DESC|Xtrackers Russell 2000 Comprehensive Factor ETF|De Minimis Firms|1600|16|2019-06-24
NMS Tier 2|DESP|Despegar.com, Corp.|De Minimis Firms|180544|613|2019-06-24
NMS Tier 2|DEST|Destination Maternity Corporation Common Stock|De Minimis Firms|141999|203|2019-06-24
NMS Tier 2|DEUR|Exchange-Traded Notes linked to the VelocityShares Daily 4X Long USD vs. EUR Index due December 6, 2|De Minimis Firms|2266|16|2019-06-24
NMS Tier 2|DEUS|Xtrackers Russell 1000 Comprehensive Factor ETF|De Minimis Firms|95676|266|2019-06-24
NMS Tier 2|DEW|WisdomTree Global High Dividend Fund|De Minimis Firms|6386|67|2019-06-24
NMS Tier 2|DEWJ|iShares Adaptive Currency Hedged MSCI Japan ETF|De Minimis Firms|1|1|2019-06-24
NMS Tier 2|DEX|DELAWARE ENHANCED GLOBAL DIVIDEND & INCOME FUND|De Minimis Firms|124331|445|2019-06-24
NMS Tier 2|DEZU|iShares Adaptive Currency Hedged MSCI Eurozone ETF|De Minimis Firms|1|1|2019-06-24
NMS Tier 2|DF|Dean Foods Company|CITADEL SECURITIES LLC|1023735|1279|2019-06-24
NMS Tier 2|DF|Dean Foods Company|De Minimis Firms|2263502|1310|2019-06-24
NMS Tier 2|DFBH|DFB Healthcare Acquisitions Corp. Common Stock|De Minimis Firms|50000|1|2019-06-24
NMS Tier 2|DFBHW|DFB Healthcare Acquisitions Corp. Warrant|De Minimis Firms|125|1|2019-06-24
NMS Tier 2|DFEN|Direxion Daily Aerospace & Defense Bull 3X Shares|De Minimis Firms|115926|575|2019-06-24
NMS Tier 2|DFFN|Diffusion Pharmaceuticals Inc. Common Stock|De Minimis Firms|751438|2277|2019-06-24
NMS Tier 2|DFIN|Donnelley Financial Solutions, Inc.|De Minimis Firms|64899|304|2019-06-24
NMS Tier 2|DFND|Reality Shares DIVCON Dividend Defender ETF|De Minimis Firms|4604|14|2019-06-24
NMS Tier 2|DFNL|Davis Fundamental ETF Trust Davis Select Financial ETF|De Minimis Firms|27708|86|2019-06-24
NMS Tier 2|DFP|FLAHERTY & CRUMRINE DYNAMIC PREFERRED AND INCOME FUND INCORPORATED|De Minimis Firms|119585|479|2019-06-24
NMS Tier 2|DFRG|Del Frisco's Restaurant Group, Inc. Common Stock|CITADEL SECURITIES LLC|2448895|4630|2019-06-24
NMS Tier 2|DFRG|Del Frisco's Restaurant Group, Inc. Common Stock|De Minimis Firms|1128699|1370|2019-06-24
NMS Tier 2|DFRG|Del Frisco's Restaurant Group, Inc. Common Stock|G1 EXECUTION SERVICES, LLC|667575|1017|2019-06-24
NMS Tier 2|DFRG|Del Frisco's Restaurant Group, Inc. Common Stock|VIRTU AMERICAS LLC|1312404|1902|2019-06-24
NMS Tier 2|DGAZ|VelocityShares 3x Inverse Natural Gas ETN  linked to the S&P GSCI Natural Gas Index Excess Return|CITADEL SECURITIES LLC|315857|2288|2019-06-24
NMS Tier 2|DGAZ|VelocityShares 3x Inverse Natural Gas ETN  linked to the S&P GSCI Natural Gas Index Excess Return|De Minimis Firms|56089|387|2019-06-24
NMS Tier 2|DGAZ|VelocityShares 3x Inverse Natural Gas ETN  linked to the S&P GSCI Natural Gas Index Excess Return|G1 EXECUTION SERVICES, LLC|153224|2049|2019-06-24
NMS Tier 2|DGAZ|VelocityShares 3x Inverse Natural Gas ETN  linked to the S&P GSCI Natural Gas Index Excess Return|VIRTU AMERICAS LLC|196319|1615|2019-06-24
NMS Tier 2|DGAZ|VelocityShares 3x Inverse Natural Gas ETN  linked to the S&P GSCI Natural Gas Index Excess Return|WOLVERINE SECURITIES, LLC|47344|2175|2019-06-24
NMS Tier 2|DGBP|Exchange-Traded Notes linked to the VelocityShares Daily 4X Long USD vs. GBP Index due December 6, 2|De Minimis Firms|701|14|2019-06-24
NMS Tier 2|DGICA|Donegal Group, Inc. Class A Common Stock|De Minimis Firms|33579|184|2019-06-24
NMS Tier 2|DGICB|Donegal Group, Inc. Class B Common Stock|De Minimis Firms|1600|2|2019-06-24
NMS Tier 2|DGII|Digi International Inc. Common Stock|De Minimis Firms|107532|333|2019-06-24
NMS Tier 2|DGL|Invesco DB Gold Fund|De Minimis Firms|42289|28|2019-06-24
NMS Tier 2|DGLD|VelocityShares 3x Inverse Gold ETN|De Minimis Firms|29953|249|2019-06-24
NMS Tier 2|DGLY|Digital Ally, Inc. Common Stock|De Minimis Firms|184066|390|2019-06-24
NMS Tier 2|DGP|DB Gold Double Long ETN due February 15, 2038|De Minimis Firms|13459|59|2019-06-24
NMS Tier 2|DGRE|WisdomTree Trust WisdomTree Emerging Markets Quality Dividend Growth Fund|De Minimis Firms|58326|190|2019-06-24
NMS Tier 2|DGRS|WisdomTree Trust WisdomTree U.S. SmallCap Quality Dividend Growth Fund|De Minimis Firms|29072|96|2019-06-24
NMS Tier 2|DGSE|DGSE Companies, Inc.|De Minimis Firms|617381|783|2019-06-24
NMS Tier 2|DGT|SPDR Global Dow ETF (based on The Global Dow)|De Minimis Firms|1903|32|2019-06-24
NMS Tier 2|DGZ|DB Gold Short ETN due February 15, 2038|De Minimis Firms|1733|10|2019-06-24
NMS Tier 2|DHDG|WisdomTree Dynamic Currency Hedged International Quality Dividend Growth Fund|De Minimis Firms|9593|22|2019-06-24
NMS Tier 2|DHF|Dreyfus High Yield Strategies Fund|De Minimis Firms|440273|593|2019-06-24
NMS Tier 2|DHIL|Diamond Hill Investment Group, Inc. Class A Common Stock|De Minimis Firms|8800|178|2019-06-24
NMS Tier 2|DHR$A|Danaher Corporation 4.75% Mandatory Convertible Preferred Stock, Series A|De Minimis Firms|61686|46|2019-06-24
NMS Tier 2|DHS|WisdomTree U.S. High Dividend Fund|De Minimis Firms|43590|310|2019-06-24
NMS Tier 2|DHT|DHT HOLDINGS, INC.|De Minimis Firms|835014|1597|2019-06-24
NMS Tier 2|DHX|DHI Group, Inc.|De Minimis Firms|787202|570|2019-06-24
NMS Tier 2|DHXM|DHX Media Ltd. Common Voting and Variable Voting Shares|De Minimis Firms|44327|114|2019-06-24
NMS Tier 2|DHY|Credit Suisse High Yield Bond Fund|De Minimis Firms|608159|592|2019-06-24
NMS Tier 2|DIAL|Columbia Diversified Fixed Income Allocation ETF|De Minimis Firms|93749|183|2019-06-24
NMS Tier 2|DIAX|NUVEEN DOW 30SM DYNAMIC OVERWRITE FUND|De Minimis Firms|153786|496|2019-06-24
NMS Tier 2|DIG|ProShares Ultra Oil & Gas|De Minimis Firms|166255|410|2019-06-24
NMS Tier 2|DIM|WisdomTree International MidCap Dividend Fund|De Minimis Firms|86361|230|2019-06-24
NMS Tier 2|DIN|Dine Brands Global, Inc.|De Minimis Firms|162227|1141|2019-06-24
NMS Tier 2|DINT|Davis Fundamental ETF Trust Davis Select International ETF|De Minimis Firms|9019|45|2019-06-24
NMS Tier 2|DIOD|Diodes Incorporated Common Stock|De Minimis Firms|176942|881|2019-06-24
NMS Tier 2|DISCB|Discovery, Inc. Series B Common Stock|De Minimis Firms|1723|114|2019-06-24
NMS Tier 2|DIT|AMCON Distributing Co.|De Minimis Firms|479|15|2019-06-24
NMS Tier 2|DIVA|AGFiQ Hedged Dividend Income Fund|De Minimis Firms|1483|32|2019-06-24
NMS Tier 2|DIVB|iShares U.S. Dividend and Buyback ETF|De Minimis Firms|1033|20|2019-06-24
NMS Tier 2|DIVO|Amplify CWP Enhanced Dividend Income ETF|De Minimis Firms|18128|91|2019-06-24
NMS Tier 2|DIVY|Reality Shares DIVS ETF|De Minimis Firms|31817|161|2019-06-24
NMS Tier 2|DJCI|ETRACS Linked to the Bloomberg Commodity Index Total Return due October 31, 2039|De Minimis Firms|4732|24|2019-06-24
NMS Tier 2|DJCO|Daily Journal Corp. (S.C.) Common Stock|De Minimis Firms|609|29|2019-06-24
NMS Tier 2|DJD|Invesco Dow Jones Industrial Average Dividend ETF|De Minimis Firms|181613|159|2019-06-24
NMS Tier 2|DJPY|Exchange-Traded Notes linked to the VelocityShares Daily 4X Long USD vs. JPY Index due December 6, 2|De Minimis Firms|1|1|2019-06-24
NMS Tier 2|DK|Delek US Holdings, Inc.|CITADEL SECURITIES LLC|210904|1127|2019-06-24
NMS Tier 2|DK|Delek US Holdings, Inc.|De Minimis Firms|400138|1177|2019-06-24
NMS Tier 2|DKL|DELEK LOGISTICS PARTNERS, LP|De Minimis Firms|31552|141|2019-06-24
NMS Tier 2|DKT|Deutsche Bank Contingent Capital Trust V 8.05% Trust Pfd.|De Minimis Firms|286789|696|2019-06-24
NMS Tier 2|DL|China Distance Education Holdings Limited|De Minimis Firms|20461|53|2019-06-24
NMS Tier 2|DLA|Delta Apparel Inc.|De Minimis Firms|15598|100|2019-06-24
NMS Tier 2|DLBR|VelocityShares Short LIBOR ETN|De Minimis Firms|926|4|2019-06-24
NMS Tier 2|DLBS|iPath US Treasury Long Bond Bear ETN|De Minimis Firms|2503|10|2019-06-24
NMS Tier 2|DLHC|DLH Holdings Corp.|De Minimis Firms|78863|355|2019-06-24
NMS Tier 2|DLNG|DYNAGAS LNG PARNERS LP|De Minimis Firms|712430|817|2019-06-24
NMS Tier 2|DLNG$A|Dynagas LNG Partners LP 9.00% Series A Cumulative Redeemable Preferred Units, liquidation preference|De Minimis Firms|75257|345|2019-06-24
NMS Tier 2|DLNG$B|Dynagas LNG Partners LP 8.75% Series B Fixed to Floating Rate Cumulative Redeemable Perpetual Prefer|De Minimis Firms|66062|165|2019-06-24
NMS Tier 2|DLPH|Delphi Technologies PLC Ordinary Shares|CITADEL SECURITIES LLC|175058|1032|2019-06-24
NMS Tier 2|DLPH|Delphi Technologies PLC Ordinary Shares|De Minimis Firms|1119034|1030|2019-06-24
NMS Tier 2|DLPN|Dolphin Entertainment, Inc. Common Stock|De Minimis Firms|94476|166|2019-06-24
NMS Tier 2|DLPNW|Dolphin Entertainment, Inc. Warrant|De Minimis Firms|904|1|2019-06-24
NMS Tier 2|DLR$C|Digital Realty Trust, Inc.  6.625 Percent Series C Cumulative Redeemable Perpetual Preferred Stock|De Minimis Firms|105023|183|2019-06-24
NMS Tier 2|DLR$G|DIGITAL REALTY TRUST, INC. 5.875% Series G Cumulative Redeemable Preferred Stock, $0.01 par value|De Minimis Firms|36961|208|2019-06-24
NMS Tier 2|DLR$I|DIGITAL RLTY TR INC PFD SR I % (MD)|De Minimis Firms|17778|205|2019-06-24
NMS Tier 2|DLR$J|Digital Realty Trust, Inc. 5.250% Series J Cumulative Redeemable Preferred Stock|De Minimis Firms|32452|173|2019-06-24
NMS Tier 2|DLR$K|Digital Realty Trust, Inc. 5.850% Series K Cumulative Redeemable Preferred Stock, par value $0.01 pe|De Minimis Firms|53386|188|2019-06-24
NMS Tier 2|DLTH|Duluth Holdings Inc. Class B Common Stock|De Minimis Firms|145898|691|2019-06-24
NMS Tier 2|DLX|Deluxe Corporation|De Minimis Firms|222069|1162|2019-06-24
NMS Tier 2|DMAC|DiaMedica Therapeutics Inc. Common Stock|De Minimis Firms|56198|63|2019-06-24
NMS Tier 2|DMB|DREYFUS MUNICIPAL BOND INFRASTRUCTURE FUND, INC.|De Minimis Firms|126380|311|2019-06-24
NMS Tier 2|DMF|Dreyfus Municipal Income Inc|De Minimis Firms|105053|232|2019-06-24
NMS Tier 2|DMLP|Dorchester Minerals, L.P. Common Units Representing Limited Partnership Interests|De Minimis Firms|87793|236|2019-06-24
NMS Tier 2|DMO|Western Asset Mortgage Defined Opportunity Fund Inc.|De Minimis Firms|116322|403|2019-06-24
NMS Tier 2|DMPI|DelMar Pharmaceuticals, Inc. Common Stock|De Minimis Firms|680317|1680|2019-06-24
NMS Tier 2|DMRC|Digimarc Corporation Common Stock|De Minimis Firms|192510|1471|2019-06-24
NMS Tier 2|DMRI|DeltaShares S&P International Managed Risk ETF|De Minimis Firms|3598|22|2019-06-24
NMS Tier 2|DMRL|DeltaShares S&P 500 Managed Risk ETF|De Minimis Firms|8254|42|2019-06-24
NMS Tier 2|DMRM|DeltaShares S&P 400 Managed Risk ETF|De Minimis Firms|2265|17|2019-06-24
NMS Tier 2|DMRS|DeltaShares S&P 600 Managed Risk ETF|De Minimis Firms|2084|17|2019-06-24
NMS Tier 2|DNBF|DNB Financial Corp Common Stock|De Minimis Firms|8483|94|2019-06-24
NMS Tier 2|DNI|Dividend and Income Fund|De Minimis Firms|64489|158|2019-06-24
NMS Tier 2|DNJR|Golden Bull Limited Ordinary Shares|De Minimis Firms|63753|294|2019-06-24
NMS Tier 2|DNL|WisdomTree Global ex-US Quality Dividend Growth Fund|De Minimis Firms|19720|129|2019-06-24
NMS Tier 2|DNLI|Denali Therapeutics Inc. Common Stock|De Minimis Firms|183391|828|2019-06-24
NMS Tier 2|DNN|Denison Mines Corp|De Minimis Firms|643714|392|2019-06-24
NMS Tier 2|DNOW|NOW INC.|De Minimis Firms|185554|1060|2019-06-24
NMS Tier 2|DNP|DNP Select Income Fund Inc.|CITADEL SECURITIES LLC|335805|1135|2019-06-24
NMS Tier 2|DNP|DNP Select Income Fund Inc.|De Minimis Firms|542351|868|2019-06-24
NMS Tier 2|DNR|Denbury Resources, Inc.|CITADEL SECURITIES LLC|9388747|3439|2019-06-24
NMS Tier 2|DNR|Denbury Resources, Inc.|De Minimis Firms|3007206|1041|2019-06-24
NMS Tier 2|DNR|Denbury Resources, Inc.|G1 EXECUTION SERVICES, LLC|3021381|1143|2019-06-24
NMS Tier 2|DNR|Denbury Resources, Inc.|VIRTU AMERICAS LLC|4385621|2579|2019-06-24
NMS Tier 2|DNR|Denbury Resources, Inc.|WOLVERINE SECURITIES, LLC|418129|3030|2019-06-24
NMS Tier 2|DO|Diamond Offshore Drilling|CITADEL SECURITIES LLC|1232540|2457|2019-06-24
NMS Tier 2|DO|Diamond Offshore Drilling|De Minimis Firms|870673|1463|2019-06-24
NMS Tier 2|DO|Diamond Offshore Drilling|VIRTU AMERICAS LLC|785557|1248|2019-06-24
NMS Tier 2|DOC|PHYSICIANS REALTY TRUST|De Minimis Firms|971002|1595|2019-06-24
NMS Tier 2|DOGS|Arrow Dogs of the World ETF|De Minimis Firms|88|5|2019-06-24
NMS Tier 2|DOGZ|Dogness (International) Corporation Class A Common Stock|De Minimis Firms|34326|107|2019-06-24
NMS Tier 2|DOL|WisdomTree International LargeCap Dividend Fund|De Minimis Firms|77718|240|2019-06-24
NMS Tier 2|DOMO|Domo, Inc. Class B Common Stock|De Minimis Firms|433451|1898|2019-06-24
NMS Tier 2|DOO|WisdomTree international Dividend Ex-Financials Fund|De Minimis Firms|48870|112|2019-06-24
NMS Tier 2|DOOO|BRP Inc. Common Subordinate Voting Shares|De Minimis Firms|5969|76|2019-06-24
NMS Tier 2|DOOR|MASONITE INTERNATIONAL CORP|De Minimis Firms|31403|392|2019-06-24
NMS Tier 2|DORM|Dorman Products, Inc. Common Stock|De Minimis Firms|72513|1057|2019-06-24
NMS Tier 2|DOVA|Dova Pharmaceuticals, Inc. Common Stock|De Minimis Firms|155776|437|2019-06-24
NMS Tier 2|DPG|DUFF & PHELPS GLOBAL UTILITY INCOME FUND INC.|De Minimis Firms|277344|885|2019-06-24
NMS Tier 2|DPK|Direxion Daily Developed Markets Bear 3x Shares|De Minimis Firms|9014|107|2019-06-24
NMS Tier 2|DPLO|DIPLOMAT PHARMACY, INC.|De Minimis Firms|702038|914|2019-06-24
NMS Tier 2|DPST|Direxion Daily Regional Banks Bull 3X Shares|De Minimis Firms|63572|146|2019-06-24
NMS Tier 2|DPW|DPW Holdings, Inc.|De Minimis Firms|3053103|1191|2019-06-24
NMS Tier 2|DPW|DPW Holdings, Inc.|G1 EXECUTION SERVICES, LLC|1456798|1338|2019-06-24
NMS Tier 2|DPW|DPW Holdings, Inc.|WOLVERINE SECURITIES, LLC|2127758|2723|2019-06-24
NMS Tier 2|DQ|DAQO NEW ENERGY CORP.|De Minimis Firms|456745|1934|2019-06-24
NMS Tier 2|DQML|Reality Shares Fundstrat DQM Long ETF|De Minimis Firms|174|3|2019-06-24
NMS Tier 2|DRAD|Digirad Corporation Common Stock|De Minimis Firms|259598|313|2019-06-24
NMS Tier 2|DRD|DRDGOLD Ltd.|De Minimis Firms|69180|184|2019-06-24
NMS Tier 2|DRH|DiamondRock Hospitality Company|De Minimis Firms|677822|658|2019-06-24
NMS Tier 2|DRIO|DarioHealth Corp. Common Stock|De Minimis Firms|451561|390|2019-06-24
NMS Tier 2|DRIOW|DarioHealth Corp. Warrant|De Minimis Firms|225|3|2019-06-24
NMS Tier 2|DRIP|Direxion Daily S&P Oil & Gas Exp. & Prod. Bear 3X Shares|CITADEL SECURITIES LLC|4237403|5525|2019-06-24
NMS Tier 2|DRIP|Direxion Daily S&P Oil & Gas Exp. & Prod. Bear 3X Shares|De Minimis Firms|2383612|3303|2019-06-24
NMS Tier 2|DRIP|Direxion Daily S&P Oil & Gas Exp. & Prod. Bear 3X Shares|VIRTU AMERICAS LLC|1583908|1600|2019-06-24
NMS Tier 2|DRIV|Global X Funds Global X Autonomous & Electric Vehicles ETF|De Minimis Firms|42266|210|2019-06-24
NMS Tier 2|DRN|Direxion Daily Real Estate Bull 3X|De Minimis Firms|78071|252|2019-06-24
NMS Tier 2|DRNA|Dicerna Pharmaceuticals, Inc. Common Stock|De Minimis Firms|345131|1155|2019-06-24
NMS Tier 2|DRQ|Dril-Quip, Inc.|De Minimis Firms|104921|727|2019-06-24
NMS Tier 2|DRR|Market Vectors Double Short Euro ETN|De Minimis Firms|181|3|2019-06-24
NMS Tier 2|DRRX|DURECT Corporation Common Stock|De Minimis Firms|832222|967|2019-06-24
NMS Tier 2|DRSK|Aptus Defined Risk ETF|De Minimis Firms|152328|28|2019-06-24
NMS Tier 2|DRUA|Dominion Energy, Inc 2016 Series A 5.25% Enhanced Junior Subordinated Notes due 2076|De Minimis Firms|206815|426|2019-06-24
NMS Tier 2|DRV|Direxion Daily Real Estate Bear 3X Shares|De Minimis Firms|428907|582|2019-06-24
NMS Tier 2|DRW|WisdomTree Global ex-US Real Estate Fund|De Minimis Firms|19376|148|2019-06-24
NMS Tier 2|DRYS|DryShips Inc. Common Stock|De Minimis Firms|710490|1372|2019-06-24
NMS Tier 2|DS|Drive Shack Inc.|De Minimis Firms|224696|590|2019-06-24
NMS Tier 2|DS$B|Drive Shack Inc. Series B 9.75% Cumulative Redeemable Preferred Stock|De Minimis Firms|2204|17|2019-06-24
NMS Tier 2|DS$D|Drive Shack Inc. 8.375% Series D Cumulative Redeemable Preferred Stock|De Minimis Firms|100|1|2019-06-24
NMS Tier 2|DSE|Duff & Phelps Select MLP and Midstream Energy Fund Inc.|De Minimis Firms|191544|429|2019-06-24
NMS Tier 2|DSGX|Descartes Systems Group Inc. (The) Common Stock|De Minimis Firms|72036|362|2019-06-24
NMS Tier 2|DSKE|Daseke, Inc. Common Stock|De Minimis Firms|328125|778|2019-06-24
NMS Tier 2|DSKEW|Daseke, Inc. Warrant|De Minimis Firms|38650|12|2019-06-24
NMS Tier 2|DSL|DOUBLELINE INCOME SOLUTIONS FUND|De Minimis Firms|626336|1579|2019-06-24
NMS Tier 2|DSLV|VelocityShares 3x Inverse Silver ETN|De Minimis Firms|112281|623|2019-06-24
NMS Tier 2|DSM|Dreyfus Strategic Municipal Bond Fund, Inc.|De Minimis Firms|195999|426|2019-06-24
NMS Tier 2|DSPG|DSP Group, Inc. Common Stock|De Minimis Firms|115349|328|2019-06-24
NMS Tier 2|DSS|Document Security Systems, Inc.|De Minimis Firms|118432|331|2019-06-24
NMS Tier 2|DSSI|Diamond S Shipping Inc. Common Shares|De Minimis Firms|117140|362|2019-06-24
NMS Tier 2|DSTL|Distillate U.S. Fundamental Stability & Value ETF|De Minimis Firms|33353|107|2019-06-24
NMS Tier 2|DSU|Blackrock Debt Strategies Fund, Inc.|De Minimis Firms|277177|866|2019-06-24
NMS Tier 2|DSWL|Deswell Industries, Inc. Common Shares|De Minimis Firms|4085|15|2019-06-24
NMS Tier 2|DSX|Diana Shipping, Inc.|De Minimis Firms|202609|321|2019-06-24
NMS Tier 2|DSX$B|DIANA SHIPPING INC 8.875% Series B Cumulative Redeemable Perpetual Preferred Shares, $0.01 par value|De Minimis Firms|16216|58|2019-06-24
NMS Tier 2|DTD|WisdomTree U.S. Total Dividend Fund|De Minimis Firms|80690|287|2019-06-24
NMS Tier 2|DTEA|DAVIDsTEA Inc. Common Stock|De Minimis Firms|317035|919|2019-06-24
NMS Tier 2|DTEC|ALPS Disruptive Technologies ETF|De Minimis Firms|29587|153|2019-06-24
NMS Tier 2|DTF|DTF Tax-Free Income Inc.|De Minimis Firms|102209|129|2019-06-24
NMS Tier 2|DTH|WisdomTree International High Dividend  Fund|De Minimis Firms|49168|229|2019-06-24
NMS Tier 2|DTIL|Precision BioSciences, Inc. Common Stock|De Minimis Firms|106539|507|2019-06-24
NMS Tier 2|DTJ|DTE Energy Company 2016 Series B 5.375% Junior Subordinated Debentures due 2076|De Minimis Firms|76832|293|2019-06-24
NMS Tier 2|DTLA$|BROOKFIELD DTLA FUND OFFICE TRUST INVESTOR INC.|De Minimis Firms|9282|64|2019-06-24
NMS Tier 2|DTN|WisdomTree U.S. Dividend ex-Financials Fund|De Minimis Firms|38668|332|2019-06-24
NMS Tier 2|DTO|DB Crude Oil Double Short Exchange Traded Notes due June 1, 2038|De Minimis Firms|3958|48|2019-06-24
NMS Tier 2|DTQ|DTE ENERGY COMPANY 2012 Series C 5.25% Junior Subordinated Debentures due 2062|De Minimis Firms|32472|175|2019-06-24
NMS Tier 2|DTSS|Datasea Inc. Common Stock|De Minimis Firms|2137|21|2019-06-24
NMS Tier 2|DTUS|iPath US Treasury 2-year Bear ETN|De Minimis Firms|200|1|2019-06-24
NMS Tier 2|DTV|DTE Energy Company 2016 Corporate Units|De Minimis Firms|190486|56|2019-06-24
NMS Tier 2|DTW|DTE Energy Company 2017 Series E 5.25% Junior Subordinated Debentures due 2077|De Minimis Firms|69107|354|2019-06-24
NMS Tier 2|DTY|DTE Energy Company 2016 Series F 6.00% Junior Subordinated Debentures due 2076|De Minimis Firms|23188|293|2019-06-24
NMS Tier 2|DTYS|iPath US Treasury 10-year Bear ETN|De Minimis Firms|31247|61|2019-06-24
NMS Tier 2|DUC|Duff & Phelps Utility & Corporate Bond Trust|De Minimis Firms|69809|147|2019-06-24
NMS Tier 2|DUG|ProShares UltraShort Oil & Gas|De Minimis Firms|44427|259|2019-06-24
NMS Tier 2|DUK$A|Duke Energy Corporation|De Minimis Firms|308788|667|2019-06-24
NMS Tier 2|DUKB|Duke Energy Corporation 5.625% Junior Subordinated Debentures due 2078|De Minimis Firms|107645|491|2019-06-24
NMS Tier 2|DUKH|Duke Energy Corporation 5.125% Junior Subordinated Debentures due January 15, 2073|De Minimis Firms|47284|278|2019-06-24
NMS Tier 2|DURA|VanEck Vectors Morningstar Durable Dividend ETF|De Minimis Firms|3052|12|2019-06-24
NMS Tier 2|DUSA|Davis Fundamental ETF Trust Davis Select U.S. Equity ETF|De Minimis Firms|19191|94|2019-06-24
NMS Tier 2|DUSL|Direxion Daily Industrials Bull 3X Shares|De Minimis Firms|9988|37|2019-06-24
NMS Tier 2|DUST|Direxion Daily Gold Miners Bear 3X Shares of Direxion Shares ETF Trust|CITADEL SECURITIES LLC|2021563|3507|2019-06-24
NMS Tier 2|DUST|Direxion Daily Gold Miners Bear 3X Shares of Direxion Shares ETF Trust|De Minimis Firms|614496|1077|2019-06-24
NMS Tier 2|DUST|Direxion Daily Gold Miners Bear 3X Shares of Direxion Shares ETF Trust|G1 EXECUTION SERVICES, LLC|887894|1191|2019-06-24
NMS Tier 2|DUST|Direxion Daily Gold Miners Bear 3X Shares of Direxion Shares ETF Trust|VIRTU AMERICAS LLC|1113323|1887|2019-06-24
NMS Tier 2|DVAX|Dynavax Technologies Corporation Common Stock|CITADEL SECURITIES LLC|1218335|2259|2019-06-24
NMS Tier 2|DVAX|Dynavax Technologies Corporation Common Stock|De Minimis Firms|1388937|2377|2019-06-24
NMS Tier 2|DVCR|Diversicare Healthcare Services Inc.|De Minimis Firms|6603|15|2019-06-24
NMS Tier 2|DVD|Dover Motorsports|De Minimis Firms|9683|41|2019-06-24
NMS Tier 2|DVEM|WisdomTree Emerging Markets Dividend Fund|De Minimis Firms|22624|52|2019-06-24
NMS Tier 2|DVHL|ETRACS Monthly Pay 2xLeveraged Diversified High Income ETN|De Minimis Firms|18766|90|2019-06-24
NMS Tier 2|DVLU|First Trust Exchange-Traded Fund VI First Trust Dorsey Wright Momentum & Value ETF|De Minimis Firms|11340|20|2019-06-24
NMS Tier 2|DVOL|First Trust Exchange-Traded Fund VI First Trust Dorsey Wright Momentum & Low Volatility ETF|De Minimis Firms|166061|87|2019-06-24
NMS Tier 2|DVP|Deep Value ETF|De Minimis Firms|98117|267|2019-06-24
NMS Tier 2|DVYA|iShares Asia/Pacific Dividend ETF|De Minimis Firms|8832|59|2019-06-24
NMS Tier 2|DVYL|ETRACS Monthly Pay 2xLeveraged Dow Jones Select Dividend Index ETN|De Minimis Firms|58614|99|2019-06-24
NMS Tier 2|DWAQ|Invesco Exchange-Traded Fund Trust  Invesco DWA NASDAQ Momentum ETF|De Minimis Firms|1373|23|2019-06-24
NMS Tier 2|DWAT|Arrow Investments Trust Arrow DWA Tactical ETF|De Minimis Firms|649|6|2019-06-24
NMS Tier 2|DWCR|Arrow Investments Trust Arrow DWA Country Rotation ETF|De Minimis Firms|322|6|2019-06-24
NMS Tier 2|DWFI|SPDR Series Trust SPDR Dorsey Wright Fixed Income Allocation ETF|De Minimis Firms|39190|155|2019-06-24
NMS Tier 2|DWIN|Invesco Exchange-Traded Fund Trust II Invesco DWA Tactical Multi-Asset Income ETF|De Minimis Firms|14708|61|2019-06-24
NMS Tier 2|DWLD|Davis Fundamental ETF Trust Davis Select Worldwide ETF|De Minimis Firms|60018|188|2019-06-24
NMS Tier 2|DWMC|AdvisorShares Trust AdvisorShares Dorsey Wright Micro-Cap ETF|De Minimis Firms|468|6|2019-06-24
NMS Tier 2|DWMF|WisdomTree International Multifactor Fund|De Minimis Firms|29135|87|2019-06-24
NMS Tier 2|DWPP|First Trust Dorsey Wright People's Portfolio ETF|De Minimis Firms|17865|43|2019-06-24
NMS Tier 2|DWSH|AdvisorShares Trust AdvisorShares Dorsey Wright Short ETF|De Minimis Firms|33314|109|2019-06-24
NMS Tier 2|DWSN|Dawson Geophysical Company Common Stock|De Minimis Firms|294163|363|2019-06-24
NMS Tier 2|DWT|VelocityShares 3x Inverse Crude Oil ETNs linked to the S&P GSCI Crude Oil Index ER|CITADEL SECURITIES LLC|10765284|6443|2019-06-24
NMS Tier 2|DWT|VelocityShares 3x Inverse Crude Oil ETNs linked to the S&P GSCI Crude Oil Index ER|De Minimis Firms|9797199|2292|2019-06-24
NMS Tier 2|DWT|VelocityShares 3x Inverse Crude Oil ETNs linked to the S&P GSCI Crude Oil Index ER|G1 EXECUTION SERVICES, LLC|3168153|1056|2019-06-24
NMS Tier 2|DWT|VelocityShares 3x Inverse Crude Oil ETNs linked to the S&P GSCI Crude Oil Index ER|VIRTU AMERICAS LLC|4184157|2275|2019-06-24
NMS Tier 2|DWTR|Invesco Exchange-Traded Fund Trust II Invesco DWA Tactical Sector Rotation ETF|De Minimis Firms|22438|71|2019-06-24
NMS Tier 2|DX|Dynex Capital, Inc.|De Minimis Firms|1110072|1758|2019-06-24
NMS Tier 2|DX$A|Dynex Capital, Inc. 8.50% Series A Cumulative Redeemable Preferred Stock|De Minimis Firms|4619|23|2019-06-24
NMS Tier 2|DX$B|Dynex Capital, Inc. 7.625% Series B Cumulative Redeemable Preferred Stock|De Minimis Firms|43818|118|2019-06-24
NMS Tier 2|DXB|Deutsche Bank Contingent Capital Trust II 6.55% Trust Preferred Securities|De Minimis Firms|208592|671|2019-06-24
NMS Tier 2|DXD|ProShares UltraShort Dow 30|De Minimis Firms|1004958|1396|2019-06-24
NMS Tier 2|DXF|Dunxin Financial Holdings Limited|De Minimis Firms|18106|34|2019-06-24
NMS Tier 2|DXGE|WisdomTree Trust WisdomTree Germany Hedged Equity Fund|De Minimis Firms|42244|30|2019-06-24
NMS Tier 2|DXJS|WisdomTree Trust WisdomTree Japan Hedged SmallCap Equity Fund|De Minimis Firms|12722|77|2019-06-24
NMS Tier 2|DXLG|Destination XL Group, Inc. Common Stock|De Minimis Firms|151458|248|2019-06-24
NMS Tier 2|DXPE|DXP Enterprises, Inc. Common Stock|De Minimis Firms|66021|227|2019-06-24
