tierDescription|issueSymbolIdentifier|issueName|marketParticipantName|MPID|totalWeeklyShareQuantity|totalWeeklyTradeCount|lastUpdateDate
OTC|PGHEF|PENGROWTH ENERGY CORP Common Shares|OTCX OTC LINK ECN ATS|OTCX|30|1|2019-06-03
OTC|PGNT|Paragon Technologies, Inc. Common Stock|ARCA GLOBAL OTC|ARCA|200|1|2019-06-03
OTC|PGNT|Paragon Technologies, Inc. Common Stock|OTCX OTC LINK ECN ATS|OTCX|700|2|2019-06-03
OTC|PGOL|Patriot Gold Corporation Common Stock|OTCX OTC LINK ECN ATS|OTCX|11800|2|2019-06-03
OTC|PGTK|Pacific Green Technologies Inc. NEW Common Stock|ARCA GLOBAL OTC|ARCA|500|3|2019-06-03
OTC|PGTK|Pacific Green Technologies Inc. NEW Common Stock|OTCX OTC LINK ECN ATS|OTCX|450|3|2019-06-03
OTC|PHGRF|Premier Health Group Inc. (Canada) Common Shares|ARCA GLOBAL OTC|ARCA|300|1|2019-06-03
OTC|PHIIQ|PHI, Inc. Common Stock|OTCX OTC LINK ECN ATS|OTCX|1271|2|2019-06-03
OTC|PHIKQ|PHI, Inc. Non-Voting Common Stock|ARCA GLOBAL OTC|ARCA|1000|1|2019-06-03
OTC|PHIKQ|PHI, Inc. Non-Voting Common Stock|OTCX OTC LINK ECN ATS|OTCX|33400|15|2019-06-03
OTC|PHIL|PHI GROUP, INC. Common Stock|ARCA GLOBAL OTC|ARCA|38555066|24|2019-06-03
OTC|PHIL|PHI GROUP, INC. Common Stock|OTCX OTC LINK ECN ATS|OTCX|1000000|2|2019-06-03
OTC|PHVAF|Phivida Holdings Inc Ordinary Shares (Canada)|ARCA GLOBAL OTC|ARCA|7016|4|2019-06-03
OTC|PHVAF|Phivida Holdings Inc Ordinary Shares (Canada)|OTCX OTC LINK ECN ATS|OTCX|57466|13|2019-06-03
OTC|PIOE|P10 Holdings, Inc. Common Stock|ARCA GLOBAL OTC|ARCA|2500|1|2019-06-03
OTC|PIOE|P10 Holdings, Inc. Common Stock|OTCX OTC LINK ECN ATS|OTCX|4953|4|2019-06-03
OTC|PIRGF|Premier Gold Mines Ltd Common Shares (Canada)|ARCA GLOBAL OTC|ARCA|1500|2|2019-06-03
OTC|PIRGF|Premier Gold Mines Ltd Common Shares (Canada)|OTCX OTC LINK ECN ATS|OTCX|2000|3|2019-06-03
OTC|PJET|Priority Aviation, Inc. Common Stock|OTCX OTC LINK ECN ATS|OTCX|150000|1|2019-06-03
OTC|PKCOY|Park 24 Co Ltd Sponsored ADR (Japan)|ARCA GLOBAL OTC|ARCA|5554|32|2019-06-03
OTC|PKIUF|Parkland Fuel Corporation Ordinary Shares (Canada)|ARCA GLOBAL OTC|ARCA|300|3|2019-06-03
OTC|PKKW|Parkway Acquisition Corp Common Stock|ARCA GLOBAL OTC|ARCA|400|4|2019-06-03
OTC|PKPH|Peak Pharmaceuticals, Inc. Common Stock|ARCA GLOBAL OTC|ARCA|501|1|2019-06-03
OTC|PKPH|Peak Pharmaceuticals, Inc. Common Stock|OTCX OTC LINK ECN ATS|OTCX|54903|12|2019-06-03
OTC|PKTX|ProtoKinetix, Inc. Common Stock|ARCA GLOBAL OTC|ARCA|68380|8|2019-06-03
OTC|PKTX|ProtoKinetix, Inc. Common Stock|OTCX OTC LINK ECN ATS|OTCX|78200|9|2019-06-03
OTC|PLFX|Pulse Evolution Corporation. Common Stock|OTCX OTC LINK ECN ATS|OTCX|177|1|2019-06-03
OTC|PLNHF|Planet 13 Holdings Inc Common Stock|OTCX OTC LINK ECN ATS|OTCX|12096|13|2019-06-03
OTC|PLPL|Plandai Biotechnology, Inc. Common Stock|OTCX OTC LINK ECN ATS|OTCX|117000|1|2019-06-03
OTC|PLPRF|Plus Prods Inc Common Shares  (Canada)|OTCX OTC LINK ECN ATS|OTCX|3095|2|2019-06-03
OTC|PLUUF|Plateau Energy Metals Inc Common Shares|ARCA GLOBAL OTC|ARCA|50|1|2019-06-03
OTC|PLUUF|Plateau Energy Metals Inc Common Shares|OTCX OTC LINK ECN ATS|OTCX|4000|1|2019-06-03
OTC|PLYZ|Plyzer Technologies Inc. Common Stock|OTCX OTC LINK ECN ATS|OTCX|26689|12|2019-06-03
OTC|PMHG|Prime Meridian Holding Co Common Shares|ARCA GLOBAL OTC|ARCA|500|2|2019-06-03
OTC|PMPG|Premier Products Group, Inc. Common Stock|ARCA GLOBAL OTC|ARCA|132300|2|2019-06-03
OTC|PMPG|Premier Products Group, Inc. Common Stock|OTCX OTC LINK ECN ATS|OTCX|97000|8|2019-06-03
OTC|PMXO|PMX Communities Inc Common Stock|ARCA GLOBAL OTC|ARCA|10558|1|2019-06-03
OTC|PNAT|Pura Naturals, Inc. Common Stock|OTCX OTC LINK ECN ATS|OTCX|510000|3|2019-06-03
OTC|PNGAY|Ping An Insurance (Group) Company of China Ltd Sponsored ADR (China)|ARCA GLOBAL OTC|ARCA|114563|463|2019-06-03
OTC|PNGAY|Ping An Insurance (Group) Company of China Ltd Sponsored ADR (China)|OTCX OTC LINK ECN ATS|OTCX|17695|30|2019-06-03
OTC|PNIK|Precious Investments, Inc. Common Stock|OTCX OTC LINK ECN ATS|OTCX|4000|2|2019-06-03
OTC|PNTV|Players Network (The) Common Stock|OTCX OTC LINK ECN ATS|OTCX|20000|1|2019-06-03
OTC|POAHY|Porsche Automobile Holding SE Unsponsored ADR (Germany)|ARCA GLOBAL OTC|ARCA|55592|59|2019-06-03
OTC|POAHY|Porsche Automobile Holding SE Unsponsored ADR (Germany)|OTCX OTC LINK ECN ATS|OTCX|6949|8|2019-06-03
OTC|POEFF|Pan Orient Energy Corp Ordinary Shares (Canada)|ARCA GLOBAL OTC|ARCA|200|2|2019-06-03
OTC|POEFF|Pan Orient Energy Corp Ordinary Shares (Canada)|OTCX OTC LINK ECN ATS|OTCX|300|3|2019-06-03
OTC|POFCY|Petrofac Ltd London Unsponsored American Depository Receipt (Jersey)|ARCA GLOBAL OTC|ARCA|400|1|2019-06-03
OTC|POLXF|Polydex Pharmaceuticals Limited Common Stock|OTCX OTC LINK ECN ATS|OTCX|10|1|2019-06-03
OTC|POTG|Portage Resources Inc. Common Stock|ARCA GLOBAL OTC|ARCA|218190|9|2019-06-03
OTC|POTN|Potnetwork Holdings, Inc. Common Stock|ARCA GLOBAL OTC|ARCA|2361|1|2019-06-03
OTC|POTN|Potnetwork Holdings, Inc. Common Stock|OTCX OTC LINK ECN ATS|OTCX|25700|4|2019-06-03
OTC|POWW|AMMO, Inc. Common Stock|ARCA GLOBAL OTC|ARCA|1372|2|2019-06-03
OTC|POWW|AMMO, Inc. Common Stock|OTCX OTC LINK ECN ATS|OTCX|1772|8|2019-06-03
OTC|PPCB|Propanc Biopharma, Inc. Common Stock|ARCA GLOBAL OTC|ARCA|740577|15|2019-06-03
OTC|PPCB|Propanc Biopharma, Inc. Common Stock|OTCX OTC LINK ECN ATS|OTCX|894598|11|2019-06-03
OTC|PPCCY|PICC Property and Casualty Company Ltd Unsponsored ADR representing Shares -H- (Hong Kong)|ARCA GLOBAL OTC|ARCA|661|5|2019-06-03
OTC|PPCLY|PPC Limited American Depositary Receipts - Sponsored|ARCA GLOBAL OTC|ARCA|1000|1|2019-06-03
OTC|PPERY|PT Bank Mandiri Persero TBK Unsponsored ADR (Indonesia)|ARCA GLOBAL OTC|ARCA|8979|23|2019-06-03
OTC|PPERY|PT Bank Mandiri Persero TBK Unsponsored ADR (Indonesia)|OTCX OTC LINK ECN ATS|OTCX|100|1|2019-06-03
OTC|PPJE|PPJ Healthcare Enterprises, Inc. Common Stock|OTCX OTC LINK ECN ATS|OTCX|200000|1|2019-06-03
OTC|PPRUY|Kering Unsponsored ADR (France)|ARCA GLOBAL OTC|ARCA|29591|54|2019-06-03
OTC|PQEFF|Petroteq Energy Inc Ordinary Shares|ARCA GLOBAL OTC|ARCA|3500|3|2019-06-03
OTC|PQEFF|Petroteq Energy Inc Ordinary Shares|OTCX OTC LINK ECN ATS|OTCX|3173|2|2019-06-03
OTC|PRDSY|Prada Spa Unsponsored ADR (Italy)|ARCA GLOBAL OTC|ARCA|400|4|2019-06-03
OTC|PRED|Predictive Technology Group, Inc. Common Stock|ARCA GLOBAL OTC|ARCA|11680|9|2019-06-03
OTC|PRED|Predictive Technology Group, Inc. Common Stock|OTCX OTC LINK ECN ATS|OTCX|10091|24|2019-06-03
OTC|PRFMF|Profound Med Corp Ordinary Shares (Canada)|ARCA GLOBAL OTC|ARCA|2000|2|2019-06-03
OTC|PRFMF|Profound Med Corp Ordinary Shares (Canada)|OTCX OTC LINK ECN ATS|OTCX|2500|1|2019-06-03
OTC|PRGNF|PARAGON SHIPPING INC Ordinary Shares|ARCA GLOBAL OTC|ARCA|179|3|2019-06-03
OTC|PRHL|Premier Holding Corp Common Stock|ARCA GLOBAL OTC|ARCA|10000|1|2019-06-03
OTC|PRHL|Premier Holding Corp Common Stock|OTCX OTC LINK ECN ATS|OTCX|550|2|2019-06-03
OTC|PRHR|Petroshare Corp Common Stock|ARCA GLOBAL OTC|ARCA|200|1|2019-06-03
OTC|PRKA|Parks! America, Inc. Common Stock|ARCA GLOBAL OTC|ARCA|100|1|2019-06-03
OTC|PRKA|Parks! America, Inc. Common Stock|OTCX OTC LINK ECN ATS|OTCX|500|1|2019-06-03
OTC|PRKR|PARKERVISION INC Common Stock|ARCA GLOBAL OTC|ARCA|4|1|2019-06-03
OTC|PRKR|PARKERVISION INC Common Stock|OTCX OTC LINK ECN ATS|OTCX|5731|3|2019-06-03
OTC|PRLX|Parallax Health Sciences Inc. Common Stock|ARCA GLOBAL OTC|ARCA|21000|1|2019-06-03
OTC|PRLX|Parallax Health Sciences Inc. Common Stock|OTCX OTC LINK ECN ATS|OTCX|94300|7|2019-06-03
OTC|PRMRF|Paramount Res Ltd Class A Shares (Canada)|ARCA GLOBAL OTC|ARCA|200|2|2019-06-03
OTC|PROBF|PROBE METALS INC  Ordinary Shares|ARCA GLOBAL OTC|ARCA|49000|7|2019-06-03
OTC|PROBF|PROBE METALS INC  Ordinary Shares|OTCX OTC LINK ECN ATS|OTCX|31000|6|2019-06-03
OTC|PROM|Propel Media, Inc Common Stock|OTCX OTC LINK ECN ATS|OTCX|163800|4|2019-06-03
OTC|PRPCF|PROPHECY DEV CORP Common Shares|OTCX OTC LINK ECN ATS|OTCX|19000|1|2019-06-03
OTC|PRPLW|Purple Innovation, Inc. Warrants Exp 02/02/2023|OTCX OTC LINK ECN ATS|OTCX|10000|1|2019-06-03
OTC|PRRE|Praetorian Property, Inc. Common Stock|ARCA GLOBAL OTC|ARCA|6000|2|2019-06-03
OTC|PRRE|Praetorian Property, Inc. Common Stock|OTCX OTC LINK ECN ATS|OTCX|9475|5|2019-06-03
OTC|PRSRF|Para Res Inc Ordinary Shares (Canada)|ARCA GLOBAL OTC|ARCA|10000|1|2019-06-03
OTC|PRVCF|PreveCeutical Medical Inc. Ordinary Shares (Canada)|OTCX OTC LINK ECN ATS|OTCX|423790|4|2019-06-03
OTC|PRYMY|Prysmian S.P.A., Milano Unsponsored ADR (Italy)|ARCA GLOBAL OTC|ARCA|4494|10|2019-06-03
OTC|PRYMY|Prysmian S.P.A., Milano Unsponsored ADR (Italy)|OTCX OTC LINK ECN ATS|OTCX|1200|3|2019-06-03
OTC|PRZFF|Prize Mining Corporation Ordinary Shares|ARCA GLOBAL OTC|ARCA|1000|1|2019-06-03
OTC|PRZM|PRISM TECHNOLOGIES GROUP INC Common Stock|ARCA GLOBAL OTC|ARCA|12000|1|2019-06-03
OTC|PSBQ|PSB Holdings, Inc. (Wisconsin) Common Stock|ARCA GLOBAL OTC|ARCA|3161|27|2019-06-03
OTC|PSGR|Pershing Resources Company, Inc. Common Stock|ARCA GLOBAL OTC|ARCA|2000|1|2019-06-03
OTC|PSGTY|Pt Semen Indonesia (Persero) Tbk Unsponsored ADR (Indonesia)|ARCA GLOBAL OTC|ARCA|32884|41|2019-06-03
OTC|PSGTY|Pt Semen Indonesia (Persero) Tbk Unsponsored ADR (Indonesia)|OTCX OTC LINK ECN ATS|OTCX|18729|23|2019-06-03
OTC|PSIQ|Profile Solutions, Inc. Common Stock|ARCA GLOBAL OTC|ARCA|3000|1|2019-06-03
OTC|PSIQ|Profile Solutions, Inc. Common Stock|OTCX OTC LINK ECN ATS|OTCX|7662|6|2019-06-03
OTC|PSIX|POWER SOLUTIONS INTL INC Common Stock|ARCA GLOBAL OTC|ARCA|850|3|2019-06-03
OTC|PSIX|POWER SOLUTIONS INTL INC Common Stock|OTCX OTC LINK ECN ATS|OTCX|200|1|2019-06-03
OTC|PSMMY|Persimmon Plc Unsponsored ADR (UK)|ARCA GLOBAL OTC|ARCA|3937|39|2019-06-03
OTC|PSPW|3Power Energy Group Inc. Common Stock|ARCA GLOBAL OTC|ARCA|400|1|2019-06-03
OTC|PSPW|3Power Energy Group Inc. Common Stock|OTCX OTC LINK ECN ATS|OTCX|5384|3|2019-06-03
OTC|PSSR|PASSUR Aerospace, Inc. Common Stock|ARCA GLOBAL OTC|ARCA|3000|2|2019-06-03
OTC|PSWR|Prism Software Corporation Common Stock|ARCA GLOBAL OTC|ARCA|350994|20|2019-06-03
OTC|PSWR|Prism Software Corporation Common Stock|OTCX OTC LINK ECN ATS|OTCX|392749|8|2019-06-03
OTC|PSYTF|Pason Systems Inc Ordinary Shares|ARCA GLOBAL OTC|ARCA|253|3|2019-06-03
OTC|PTAIY|Pt Astra International TBK Unsponsored ADR (Indonesia)|ARCA GLOBAL OTC|ARCA|5562|18|2019-06-03
OTC|PTAIY|Pt Astra International TBK Unsponsored ADR (Indonesia)|OTCX OTC LINK ECN ATS|OTCX|100|1|2019-06-03
OTC|PTAM|Potash America, Inc. Common Stock|ARCA GLOBAL OTC|ARCA|24800|2|2019-06-03
OTC|PTBBU|POET BIOREFINING LLC Unit|VIAT VARIABLE INVESTMENT ADVISORS, INC.|VIAT|75000|4|2019-06-03
OTC|PTBS|Potomac Bancshares Inc Common Stock|ARCA GLOBAL OTC|ARCA|47|2|2019-06-03
OTC|PTLF|Petlife Pharmaceuticals, Inc Common Stock|ARCA GLOBAL OTC|ARCA|9373|1|2019-06-03
OTC|PTNYF|Parcelpal Technology Inc Ordinary Shares (Canada)|ARCA GLOBAL OTC|ARCA|200|1|2019-06-03
OTC|PTNYF|Parcelpal Technology Inc Ordinary Shares (Canada)|OTCX OTC LINK ECN ATS|OTCX|55915|14|2019-06-03
OTC|PTOI|Plastic2Oil, Inc.  Common Stock|ARCA GLOBAL OTC|ARCA|4381|2|2019-06-03
OTC|PTOI|Plastic2Oil, Inc.  Common Stock|OTCX OTC LINK ECN ATS|OTCX|30800|3|2019-06-03
OTC|PTOP|Peer to Peer Network Common Stock|OTCX OTC LINK ECN ATS|OTCX|45440|2|2019-06-03
OTC|PTOTF|Patriot One Technologies Inc. Ordinary Shares (Canada)|ARCA GLOBAL OTC|ARCA|8544|14|2019-06-03
OTC|PTOTF|Patriot One Technologies Inc. Ordinary Shares (Canada)|OTCX OTC LINK ECN ATS|OTCX|9400|9|2019-06-03
OTC|PTRC|Petro River Oil Corp Common Shares|ARCA GLOBAL OTC|ARCA|650|1|2019-06-03
OTC|PTRC|Petro River Oil Corp Common Shares|OTCX OTC LINK ECN ATS|OTCX|10282|9|2019-06-03
OTC|PTSC|Patriot Scientific Corporation Common Stock|OTCX OTC LINK ECN ATS|OTCX|7750|4|2019-06-03
OTC|PTXTQ|PERNIX THERAPEUTICS HLDGS INC Common Stock|OTCX OTC LINK ECN ATS|OTCX|2000|1|2019-06-03
OTC|PUBGY|Publicis Groupe S.A. Common Stock|ARCA GLOBAL OTC|ARCA|3658|24|2019-06-03
OTC|PUBGY|Publicis Groupe S.A. Common Stock|OTCX OTC LINK ECN ATS|OTCX|2367|5|2019-06-03
OTC|PUFXF|Agraflora Organics Intl Inc Ordinary Shares|ARCA GLOBAL OTC|ARCA|7978|3|2019-06-03
OTC|PUFXF|Agraflora Organics Intl Inc Ordinary Shares|OTCX OTC LINK ECN ATS|OTCX|54414|7|2019-06-03
OTC|PUGOY|Peugeot SA Unsponsored ADR (France)|ARCA GLOBAL OTC|ARCA|842|4|2019-06-03
OTC|PUPS|Pick-Ups Plus, Inc. Common Stock|ARCA GLOBAL OTC|ARCA|205000|3|2019-06-03
OTC|PUPS|Pick-Ups Plus, Inc. Common Stock|OTCX OTC LINK ECN ATS|OTCX|642900|4|2019-06-03
OTC|PURA|Puration Inc. Common Stock|ARCA GLOBAL OTC|ARCA|100000|7|2019-06-03
OTC|PVCT|PROVECTUS BIOPHARMACEUTICALS INC Common Stock|OTCX OTC LINK ECN ATS|OTCX|72435|7|2019-06-03
OTC|PVDG|Poverty Dignified, Inc. Common Stock|ARCA GLOBAL OTC|ARCA|645000|12|2019-06-03
OTC|PVDG|Poverty Dignified, Inc. Common Stock|OTCX OTC LINK ECN ATS|OTCX|345000|9|2019-06-03
OTC|PWCO|PwrCor, Inc. Common Stock|OTCX OTC LINK ECN ATS|OTCX|2753|3|2019-06-03
OTC|PWRMF|Power Metals Corp Common Shares|OTCX OTC LINK ECN ATS|OTCX|2000|1|2019-06-03
OTC|PXPP|Phoenix Apps, Inc. Common Stock|ARCA GLOBAL OTC|ARCA|14600|11|2019-06-03
OTC|PXPP|Phoenix Apps, Inc. Common Stock|OTCX OTC LINK ECN ATS|OTCX|3725|4|2019-06-03
OTC|PYTG|Pyramidion Technology Group, Inc. Common Stock|OTCX OTC LINK ECN ATS|OTCX|10030|6|2019-06-03
OTC|QBCRF|Quebecor Inc. Ordinary Shares|ARCA GLOBAL OTC|ARCA|600|6|2019-06-03
OTC|QBCRF|Quebecor Inc. Ordinary Shares|OTCX OTC LINK ECN ATS|OTCX|600|6|2019-06-03
OTC|QBIEY|QBE Insurance Group Ltd Sponsored American Depository Receipt (Australia)|ARCA GLOBAL OTC|ARCA|18197|41|2019-06-03
OTC|QBIO|Q BioMed Inc. Common Stock|ARCA GLOBAL OTC|ARCA|3800|14|2019-06-03
OTC|QBIO|Q BioMed Inc. Common Stock|OTCX OTC LINK ECN ATS|OTCX|400|2|2019-06-03
OTC|QEGY|Quantum Energy Inc. Common Stock|OTCX OTC LINK ECN ATS|OTCX|2000|1|2019-06-03
OTC|QEPC|Q.E.P. Co., Inc. Common Stock|ARCA GLOBAL OTC|ARCA|100|1|2019-06-03
OTC|QEPC|Q.E.P. Co., Inc. Common Stock|OTCX OTC LINK ECN ATS|OTCX|200|2|2019-06-03
OTC|QILFF|Organic Flower Invts Group Inc Ordinary Shares|OTCX OTC LINK ECN ATS|OTCX|14000|5|2019-06-03
OTC|QMCI|QuoteMedia, Inc. Common Stock|ARCA GLOBAL OTC|ARCA|14700|1|2019-06-03
OTC|QMCI|QuoteMedia, Inc. Common Stock|OTCX OTC LINK ECN ATS|OTCX|3000|1|2019-06-03
OTC|QMCO|QUANTUM CORP Common Stock|ARCA GLOBAL OTC|ARCA|51666|69|2019-06-03
OTC|QMCO|QUANTUM CORP Common Stock|OTCX OTC LINK ECN ATS|OTCX|200|2|2019-06-03
OTC|QPRC|Quest Patent Research Corporation Common Stock|OTCX OTC LINK ECN ATS|OTCX|35800|1|2019-06-03
OTC|QSEP|QS Energy, Inc. Common Stock|OTCX OTC LINK ECN ATS|OTCX|10000|2|2019-06-03
OTC|QSMG|QUEST MGMT INC Common Stock|ARCA GLOBAL OTC|ARCA|40128|3|2019-06-03
OTC|QTMM|Quantum Materials Corp. Common Stock|OTCX OTC LINK ECN ATS|OTCX|72336|4|2019-06-03
OTC|QUAN|Quantum International Corporation. Common Stock|ARCA GLOBAL OTC|ARCA|85100|6|2019-06-03
OTC|QUAN|Quantum International Corporation. Common Stock|OTCX OTC LINK ECN ATS|OTCX|2073|1|2019-06-03
OTC|QUES|Quest Solution, Inc. Common Stock|OTCX OTC LINK ECN ATS|OTCX|100|1|2019-06-03
OTC|QWTR|Quest Water Global Inc. Common|ARCA GLOBAL OTC|ARCA|12000|1|2019-06-03
OTC|QWTR|Quest Water Global Inc. Common|OTCX OTC LINK ECN ATS|OTCX|27500|2|2019-06-03
OTC|QYBX|Qian Yuan Baixing, Inc. Common Stock|ARCA GLOBAL OTC|ARCA|95800|1|2019-06-03
OTC|RADLY|Raia Drogasil SA American Depositary Receipts - Sponsored (Brazil)|ARCA GLOBAL OTC|ARCA|400|4|2019-06-03
OTC|RAIO|Radioio, Inc. Common Stock|ARCA GLOBAL OTC|ARCA|10|1|2019-06-03
OTC|RANJY|Randstad NV American Depositary Receipts - Unsponsored|ARCA GLOBAL OTC|ARCA|1352|10|2019-06-03
OTC|RASF|RAIT FINL TR Common Stock|ARCA GLOBAL OTC|ARCA|1|1|2019-06-03
OTC|RASFO|RAIT Financial Trust 8.375% Series B Cumulative Redeemable Preferred Shares|ARCA GLOBAL OTC|ARCA|100|1|2019-06-03
OTC|RBGLY|Reckitt Benckiser Plc Sponsored ADR|ARCA GLOBAL OTC|ARCA|184890|489|2019-06-03
OTC|RBGLY|Reckitt Benckiser Plc Sponsored ADR|OTCX OTC LINK ECN ATS|OTCX|21142|28|2019-06-03
OTC|RBII|Rising Biosciences, Inc. Common Stock|ARCA GLOBAL OTC|ARCA|584135|7|2019-06-03
OTC|RBYCF|RUBICON MINERALS CORP Common Shares|OTCX OTC LINK ECN ATS|OTCX|9908|17|2019-06-03
OTC|RCGP|Radiant Creations Group, Inc. (The) Common Stock|ARCA GLOBAL OTC|ARCA|7|3|2019-06-03
OTC|RCGP|Radiant Creations Group, Inc. (The) Common Stock|OTCX OTC LINK ECN ATS|OTCX|5000|1|2019-06-03
OTC|RCHA|Rich Pharmaceuticals, Inc Common Stock|ARCA GLOBAL OTC|ARCA|200000|1|2019-06-03
OTC|RCIT|Reelcause, Inc. Common Stock|OTCX OTC LINK ECN ATS|OTCX|9022|1|2019-06-03
OTC|RCPIQ|Rock Creek Pharmaceuticals, Inc. Common Stock|ARCA GLOBAL OTC|ARCA|929072|5|2019-06-03
OTC|RDEIY|Red Electrica Corporacion SA Unsponsored ADR (Spain)|ARCA GLOBAL OTC|ARCA|13763|31|2019-06-03
OTC|RDEIY|Red Electrica Corporacion SA Unsponsored ADR (Spain)|OTCX OTC LINK ECN ATS|OTCX|400|3|2019-06-03
OTC|RDGL|Vivos Inc Common Stock|ARCA GLOBAL OTC|ARCA|659750|8|2019-06-03
OTC|RDGL|Vivos Inc Common Stock|OTCX OTC LINK ECN ATS|OTCX|24000|2|2019-06-03
OTC|RDSMY|Royal DSM NV Sponsored ADR (Netherlands)|ARCA GLOBAL OTC|ARCA|10212|42|2019-06-03
OTC|RDSMY|Royal DSM NV Sponsored ADR (Netherlands)|OTCX OTC LINK ECN ATS|OTCX|1300|4|2019-06-03
OTC|RDVWF|RadView Software, Ltd. Ordinary Shares (Israel)|ARCA GLOBAL OTC|ARCA|20000|1|2019-06-03
OTC|REEI|Ree International, Inc. Common Stock|ARCA GLOBAL OTC|ARCA|69500|1|2019-06-03
OTC|REEMF|Rare Element Resources Ltd. Common Stock|OTCX OTC LINK ECN ATS|OTCX|18277|3|2019-06-03
OTC|REFG|Medical Cannabis Payment Solutions. Common Stock|ARCA GLOBAL OTC|ARCA|10452|1|2019-06-03
OTC|REFG|Medical Cannabis Payment Solutions. Common Stock|OTCX OTC LINK ECN ATS|OTCX|4000|2|2019-06-03
OTC|REMI|Remedent, Inc. Common Stock|ARCA GLOBAL OTC|ARCA|2000|1|2019-06-03
OTC|REOS|ReoStar Energy Corporation Common Stock|ARCA GLOBAL OTC|ARCA|30000|1|2019-06-03
OTC|REPR|Repro-Med Systems Inc Common Stock|ARCA GLOBAL OTC|ARCA|400|1|2019-06-03
OTC|REPR|Repro-Med Systems Inc Common Stock|OTCX OTC LINK ECN ATS|OTCX|10853|10|2019-06-03
OTC|REPYY|Repsol S.A. Sponsored ADR (Spain)|ARCA GLOBAL OTC|ARCA|132387|358|2019-06-03
OTC|REPYY|Repsol S.A. Sponsored ADR (Spain)|OTCX OTC LINK ECN ATS|OTCX|7513|10|2019-06-03
OTC|RESCU|Rescap Liquidating Trust Units|ARCA GLOBAL OTC|ARCA|700|3|2019-06-03
OTC|RETC|12 Retech Corporation Common Stock|ARCA GLOBAL OTC|ARCA|24523331|43|2019-06-03
OTC|RETC|12 Retech Corporation Common Stock|OTCX OTC LINK ECN ATS|OTCX|1500000|4|2019-06-03
OTC|REVB|Revere Bank Laurel MD Com|ARCA GLOBAL OTC|ARCA|2755|7|2019-06-03
OTC|REVI|RESOURCE VENTURES INC Common Stock|ARCA GLOBAL OTC|ARCA|300|3|2019-06-03
OTC|RFBC|Romana Food Brands Corp. Common Stock|OTCX OTC LINK ECN ATS|OTCX|2000|1|2019-06-03
OTC|RFTA|RAIT Financial Trust 7.125% Senior Notes due 2019|ARCA GLOBAL OTC|ARCA|1400|3|2019-06-03
OTC|RFTA|RAIT Financial Trust 7.125% Senior Notes due 2019|OTCX OTC LINK ECN ATS|OTCX|4975|14|2019-06-03
OTC|RFTT|RAIT Financial Trust 7.625% Senior Note due 2024|OTCX OTC LINK ECN ATS|OTCX|1000|2|2019-06-03
OTC|RGBP|Regen Biopharma, Inc. Common|ARCA GLOBAL OTC|ARCA|6791667|51|2019-06-03
OTC|RGBPP|Regen Biopharma, Inc. Preferred Stock|ARCA GLOBAL OTC|ARCA|50079|6|2019-06-03
OTC|RGDCF|92 Resources Corp. Ordinary Shares (Canada)|OTCX OTC LINK ECN ATS|OTCX|38000|2|2019-06-03
OTC|RGFR|Rangeford Resources Inc. Common Stock|ARCA GLOBAL OTC|ARCA|150|1|2019-06-03
OTC|RGIN|Regenicin, Inc. Common Stock|OTCX OTC LINK ECN ATS|OTCX|25903|5|2019-06-03
OTC|RGLG|UHF Logistics Group, Inc. Common Stock|ARCA GLOBAL OTC|ARCA|38800|6|2019-06-03
OTC|RGLG|UHF Logistics Group, Inc. Common Stock|OTCX OTC LINK ECN ATS|OTCX|41068|6|2019-06-03
OTC|RGLXY|RTL Group Sa Luxembourg Unsponsored ADR (Luxembourg)|OTCX OTC LINK ECN ATS|OTCX|200|2|2019-06-03
OTC|RGNP|Reign Sappphire Corp Common Stock|ARCA GLOBAL OTC|ARCA|10000|1|2019-06-03
OTC|RGSE|REAL GOODS SOLAR INC Class A Common Stock|OTCX OTC LINK ECN ATS|OTCX|98100|10|2019-06-03
OTC|RGUS|REGI U.S., Inc. Common Stock|ARCA GLOBAL OTC|ARCA|6810|5|2019-06-03
OTC|RHDGF|Retail Holdings N.V. Ordinary Shares (Netherlands Antilles)|ARCA GLOBAL OTC|ARCA|3500|7|2019-06-03
OTC|RHDGF|Retail Holdings N.V. Ordinary Shares (Netherlands Antilles)|OTCX OTC LINK ECN ATS|OTCX|1565|3|2019-06-03
OTC|RHHBY|Roche Holdings AG Basel American Depositary Shares|ARCA GLOBAL OTC|ARCA|797682|2770|2019-06-03
OTC|RHHBY|Roche Holdings AG Basel American Depositary Shares|DBOX DBOT ATS, LLC|DBOX|10342|21|2019-06-03
OTC|RHHBY|Roche Holdings AG Basel American Depositary Shares|OTCX OTC LINK ECN ATS|OTCX|93907|130|2019-06-03
OTC|RHNO|Rhino Resource Partners LP Common Stock|ARCA GLOBAL OTC|ARCA|450|2|2019-06-03
OTC|RHNO|Rhino Resource Partners LP Common Stock|OTCX OTC LINK ECN ATS|OTCX|1400|3|2019-06-03
OTC|RIOCF|Riocan Real Estate Inv Tr Ordinary Shares|ARCA GLOBAL OTC|ARCA|500|3|2019-06-03
OTC|RJDG|RJD Green Inc Common Stock|OTCX OTC LINK ECN ATS|OTCX|20000|2|2019-06-03
OTC|RKUNY|Rakuten Inc Sponsored ADR (Japan)|ARCA GLOBAL OTC|ARCA|23858|125|2019-06-03
OTC|RKUNY|Rakuten Inc Sponsored ADR (Japan)|OTCX OTC LINK ECN ATS|OTCX|362|4|2019-06-03
OTC|RLAB|Real American Capital Corporation. Common Stock|ARCA GLOBAL OTC|ARCA|62|1|2019-06-03
OTC|RLBD|Real Brands, Inc.  NEW Common Stock|OTCX OTC LINK ECN ATS|OTCX|40000|3|2019-06-03
OTC|RLMD|Relmada Therapeutics, Inc. Common Stock|ARCA GLOBAL OTC|ARCA|7433|3|2019-06-03
OTC|RLMD|Relmada Therapeutics, Inc. Common Stock|OTCX OTC LINK ECN ATS|OTCX|7483|9|2019-06-03
OTC|RLTR|Reeltime Rentals Inc Common Stock|ARCA GLOBAL OTC|ARCA|52000|3|2019-06-03
OTC|RMHBD|Rocky Mountain High Brands, Inc. Common Stock|ARCA GLOBAL OTC|ARCA|246800|17|2019-06-03
OTC|RMHBD|Rocky Mountain High Brands, Inc. Common Stock|OTCX OTC LINK ECN ATS|OTCX|92963|8|2019-06-03
OTC|RMRK|Rimrock Gold Corp. Common Stock|ARCA GLOBAL OTC|ARCA|1000000|2|2019-06-03
OTC|RMRK|Rimrock Gold Corp. Common Stock|OTCX OTC LINK ECN ATS|OTCX|100000|2|2019-06-03
OTC|RMSL|RemSleep Holdings, Inc. Common Stock|OTCX OTC LINK ECN ATS|OTCX|5000|1|2019-06-03
OTC|RNGC|Ranger Gold Corp. Common Stock|ARCA GLOBAL OTC|ARCA|63800|4|2019-06-03
OTC|RNKLF|Royal Nickel Corp. Ordinary Shares (Canada)|ARCA GLOBAL OTC|ARCA|14000|3|2019-06-03
OTC|RNKLF|Royal Nickel Corp. Ordinary Shares (Canada)|OTCX OTC LINK ECN ATS|OTCX|4000|1|2019-06-03
OTC|RNLSY|Renault S.A. Unsponsored American Depository Receipt (France)|ARCA GLOBAL OTC|ARCA|4430|23|2019-06-03
OTC|RNLSY|Renault S.A. Unsponsored American Depository Receipt (France)|OTCX OTC LINK ECN ATS|OTCX|4834|8|2019-06-03
OTC|RNSGF|Renaissance Gold, Inc. Ordinary Shares (Canada)|OTCX OTC LINK ECN ATS|OTCX|35000|4|2019-06-03
OTC|RNWR|808 Renewable Energy Corp. Common|ARCA GLOBAL OTC|ARCA|5000|1|2019-06-03
OTC|ROBK|ROTATE BLACK INC Common Stock|ARCA GLOBAL OTC|ARCA|2000|1|2019-06-03
OTC|ROHCY|Rohm Co Ltd Unsponsored ADR (Japan)|ARCA GLOBAL OTC|ARCA|100|1|2019-06-03
OTC|ROMJF|Rubicon Organics Inc Common Shares (Canada)|ARCA GLOBAL OTC|ARCA|595|3|2019-06-03
OTC|ROMJF|Rubicon Organics Inc Common Shares (Canada)|OTCX OTC LINK ECN ATS|OTCX|100|1|2019-06-03
OTC|ROSGQ|Rosetta Genomics Ltd. Ordinary Shares|ARCA GLOBAL OTC|ARCA|83|1|2019-06-03
OTC|ROYL|Royale Energy, Inc.|ARCA GLOBAL OTC|ARCA|20000|3|2019-06-03
OTC|ROYL|Royale Energy, Inc.|OTCX OTC LINK ECN ATS|OTCX|50555|10|2019-06-03
OTC|ROYMY|Royal Mail PLC Unsponsored ADR (United Kingdom)|ARCA GLOBAL OTC|ARCA|13606|31|2019-06-03
OTC|ROYMY|Royal Mail PLC Unsponsored ADR (United Kingdom)|OTCX OTC LINK ECN ATS|OTCX|1934|9|2019-06-03
OTC|RPMT|Rego Payment Architectures, Inc. Common Stock|OTCX OTC LINK ECN ATS|OTCX|7400|10|2019-06-03
OTC|RSAU|Rooshine Inc. Common Stock|OTCX OTC LINK ECN ATS|OTCX|675100|13|2019-06-03
OTC|RSCZF|RESINCO CAP PARTNERS INC Common Shares|ARCA GLOBAL OTC|ARCA|10000|1|2019-06-03
OTC|RSHN|RushNet Inc|OTCX OTC LINK ECN ATS|OTCX|70000|1|2019-06-03
OTC|RSNAY|RSA Insurance Group PLC Sponsored ADR|ARCA GLOBAL OTC|ARCA|4011|12|2019-06-03
OTC|RSSFF|Affinor Growers, Inc. Ordinary Shares (Canada)|OTCX OTC LINK ECN ATS|OTCX|4500|2|2019-06-03
OTC|RSSS|Research Solutions, Inc. Common Stock|ARCA GLOBAL OTC|ARCA|452|1|2019-06-03
OTC|RSSS|Research Solutions, Inc. Common Stock|OTCX OTC LINK ECN ATS|OTCX|1561|2|2019-06-03
OTC|RSSV|Resort Savers, Inc. Common Stock|ARCA GLOBAL OTC|ARCA|9600|4|2019-06-03
OTC|RSSV|Resort Savers, Inc. Common Stock|OTCX OTC LINK ECN ATS|OTCX|13351|5|2019-06-03
OTC|RTMVY|Rightmove Plc Unsponsored ADR (United Kingdom)|ARCA GLOBAL OTC|ARCA|12570|31|2019-06-03
OTC|RTMVY|Rightmove Plc Unsponsored ADR (United Kingdom)|OTCX OTC LINK ECN ATS|OTCX|3227|8|2019-06-03
OTC|RTNB|root9B Holdings, Inc. Common Stock|ARCA GLOBAL OTC|ARCA|604|3|2019-06-03
OTC|RTOKY|Rentokil Initial Plc (Fgn) American Depositary Shares|ARCA GLOBAL OTC|ARCA|16343|28|2019-06-03
OTC|RUSMF|Russel Metals, Inc. Ordinary Shares|ARCA GLOBAL OTC|ARCA|100|1|2019-06-03
OTC|RUSMF|Russel Metals, Inc. Ordinary Shares|OTCX OTC LINK ECN ATS|OTCX|300|2|2019-06-03
OTC|RVIV|Reviv3 Procare Co Common Stock|OTCX OTC LINK ECN ATS|OTCX|6620|2|2019-06-03
OTC|RVLGF|Revival Gold Inc. Ordinary Shares (Canada)|OTCX OTC LINK ECN ATS|OTCX|3500|2|2019-06-03
OTC|RVRA|Riviera Resources Inc Common Stock|OTCX OTC LINK ECN ATS|OTCX|1300|2|2019-06-03
OTC|RVSDF|Riverside Res Inc Common shares (Canada)|ARCA GLOBAL OTC|ARCA|6500|2|2019-06-03
OTC|RVSDF|Riverside Res Inc Common shares (Canada)|OTCX OTC LINK ECN ATS|OTCX|50000|1|2019-06-03
OTC|RVVQF|Ravenquest Biomed Inc Ordinary Shares (Canada)|ARCA GLOBAL OTC|ARCA|8403|9|2019-06-03
OTC|RVVQF|Ravenquest Biomed Inc Ordinary Shares (Canada)|OTCX OTC LINK ECN ATS|OTCX|10|1|2019-06-03
OTC|RVXCF|Resverlogix Corp Common Stock|ARCA GLOBAL OTC|ARCA|27584|93|2019-06-03
OTC|RVXCF|Resverlogix Corp Common Stock|OTCX OTC LINK ECN ATS|OTCX|11492|27|2019-06-03
OTC|RWCRF|RIWI Corp. Ordinary Shares (Canada)|ARCA GLOBAL OTC|ARCA|9200|8|2019-06-03
OTC|RWEOY|Rwe Ag Ord Bearer Dm5 American Depository Receipt|ARCA GLOBAL OTC|ARCA|24635|67|2019-06-03
OTC|RWEOY|Rwe Ag Ord Bearer Dm5 American Depository Receipt|OTCX OTC LINK ECN ATS|OTCX|200|1|2019-06-03
OTC|RWWI|Rand Worldwide, Inc. Common Stock|OTCX OTC LINK ECN ATS|OTCX|53449|81|2019-06-03
OTC|RXMD|Progressive Care, Inc. Common Stock|ARCA GLOBAL OTC|ARCA|20000|1|2019-06-03
