tierDescription|issueSymbolIdentifier|issueName|marketParticipantName|MPID|totalWeeklyShareQuantity|totalWeeklyTradeCount|lastUpdateDate
OTC|KRFG|King Resources Inc. Common Stock|ARCA GLOBAL OTC|ARCA|159000|5|2019-06-03
OTC|KRFG|King Resources Inc. Common Stock|OTCX OTC LINK ECN ATS|OTCX|231378|4|2019-06-03
OTC|KRKNF|Kraken Robotics Inc. Ordinary Shares|ARCA GLOBAL OTC|ARCA|4053|2|2019-06-03
OTC|KRKNF|Kraken Robotics Inc. Ordinary Shares|OTCX OTC LINK ECN ATS|OTCX|400|4|2019-06-03
OTC|KROTY|Kroton Educacional SA, Brazil Sponsored ADR (Brazil)|ARCA GLOBAL OTC|ARCA|22351|21|2019-06-03
OTC|KROTY|Kroton Educacional SA, Brazil Sponsored ADR (Brazil)|OTCX OTC LINK ECN ATS|OTCX|41965|128|2019-06-03
OTC|KRYAY|Kerry Group Plc Sponsored ADR (Ireland)|ARCA GLOBAL OTC|ARCA|2057|11|2019-06-03
OTC|KSHB|KushCo Holdings, Inc. Common Stock|ARCA GLOBAL OTC|ARCA|59656|223|2019-06-03
OTC|KSHB|KushCo Holdings, Inc. Common Stock|DBOX DBOT ATS, LLC|DBOX|463|1|2019-06-03
OTC|KSHB|KushCo Holdings, Inc. Common Stock|OTCX OTC LINK ECN ATS|OTCX|27823|63|2019-06-03
OTC|KSRYY|Kose Corp American Depositary Receipts - Unsponsored (Japan)|ARCA GLOBAL OTC|ARCA|420|3|2019-06-03
OTC|KSRYY|Kose Corp American Depositary Receipts - Unsponsored (Japan)|OTCX OTC LINK ECN ATS|OTCX|1177|7|2019-06-03
OTC|KUBTY|Kubota Corporation|ARCA GLOBAL OTC|ARCA|9806|83|2019-06-03
OTC|KUBTY|Kubota Corporation|OTCX OTC LINK ECN ATS|OTCX|260|4|2019-06-03
OTC|KWBT|Kiwa Bio-Tech Products Group Corporation Common Stock|OTCX OTC LINK ECN ATS|OTCX|1500|3|2019-06-03
OTC|KWHIY|Kawasaki Heavy Industries Ltd Sponsored American Depositary Shares|ARCA GLOBAL OTC|ARCA|118|2|2019-06-03
OTC|KWHIY|Kawasaki Heavy Industries Ltd Sponsored American Depositary Shares|OTCX OTC LINK ECN ATS|OTCX|224|3|2019-06-03
OTC|KYNC|KYN Capital Group, Inc. Common Stock|ARCA GLOBAL OTC|ARCA|250000|3|2019-06-03
OTC|KYOCY|Kyocera Corp American Depositary Receipts - Sponsored (Japan)|ARCA GLOBAL OTC|ARCA|10624|51|2019-06-03
OTC|KZMYY|Kaz Minerals Plc American Depositary Receipts - Unsponsored|ARCA GLOBAL OTC|ARCA|300|1|2019-06-03
OTC|KZMYY|Kaz Minerals Plc American Depositary Receipts - Unsponsored|OTCX OTC LINK ECN ATS|OTCX|42|1|2019-06-03
OTC|LAACZ|Laaco Ltd L P Uts Miscellaneous|OTCX OTC LINK ECN ATS|OTCX|2|2|2019-06-03
OTC|LADFF|New Carolin Gold Corp. Ordinary Shares|ARCA GLOBAL OTC|ARCA|1300|1|2019-06-03
OTC|LBCC|Long Blockchain Corp. Cmn Stk Common Stock|ARCA GLOBAL OTC|ARCA|5400|3|2019-06-03
OTC|LBCP|Liberty Bancorp, Inc. Common Stock|ARCA GLOBAL OTC|ARCA|5700|13|2019-06-03
OTC|LBLCF|Loblaw Companies Ltd Cda Ordinary Shares|OTCX OTC LINK ECN ATS|OTCX|1|1|2019-06-03
OTC|LBSR|Liberty Star Uranium & Metals Corp. Common Stock|ARCA GLOBAL OTC|ARCA|30000|1|2019-06-03
OTC|LBUY|Leafbuyer Technologies, Inc. Common Shares|ARCA GLOBAL OTC|ARCA|500|1|2019-06-03
OTC|LBUY|Leafbuyer Technologies, Inc. Common Shares|OTCX OTC LINK ECN ATS|OTCX|3400|4|2019-06-03
OTC|LCDX|Lucid Inc Common Stock|OTCX OTC LINK ECN ATS|OTCX|500|1|2019-06-03
OTC|LCLP|Life Clips, Inc. Common Stock|ARCA GLOBAL OTC|ARCA|745110|3|2019-06-03
OTC|LDSI|Life Design Station International, Inc. Common Stock|ARCA GLOBAL OTC|ARCA|2620000|22|2019-06-03
OTC|LDSI|Life Design Station International, Inc. Common Stock|OTCX OTC LINK ECN ATS|OTCX|513700|19|2019-06-03
OTC|LDSR|Landstar, Inc. Common Stock|ARCA GLOBAL OTC|ARCA|200000|3|2019-06-03
OTC|LDSYF|Lifestyle Delivery Systems, Inc. Common Shares (Canada)|ARCA GLOBAL OTC|ARCA|18400|4|2019-06-03
OTC|LEAI|Legacy Education Alliance, Inc. Common Stock|ARCA GLOBAL OTC|ARCA|1600|1|2019-06-03
OTC|LEAI|Legacy Education Alliance, Inc. Common Stock|OTCX OTC LINK ECN ATS|OTCX|2500|1|2019-06-03
OTC|LEDIF|LED Medical Diagnostics Inc Common Shares|ARCA GLOBAL OTC|ARCA|1120|1|2019-06-03
OTC|LEGE|Legend Media, Inc. Common Stock|ARCA GLOBAL OTC|ARCA|24700|3|2019-06-03
OTC|LEGX|LegacyXChange, Inc Common Stock|ARCA GLOBAL OTC|ARCA|5900|1|2019-06-03
OTC|LEMIF|Leading Edge Materials Corp. Common Shares|ARCA GLOBAL OTC|ARCA|60782|5|2019-06-03
OTC|LEMIF|Leading Edge Materials Corp. Common Shares|OTCX OTC LINK ECN ATS|OTCX|71100|6|2019-06-03
OTC|LEXG|Lithium Exploration Group, Inc. Common Stock|ARCA GLOBAL OTC|ARCA|23506|3|2019-06-03
OTC|LEXG|Lithium Exploration Group, Inc. Common Stock|OTCX OTC LINK ECN ATS|OTCX|23388|5|2019-06-03
OTC|LFAP|LifeApps Brands Inc. Common Stock|OTCX OTC LINK ECN ATS|OTCX|101066|17|2019-06-03
OTC|LFER|Life on Earth, Inc. Common Stock|ARCA GLOBAL OTC|ARCA|4500|1|2019-06-03
OTC|LFER|Life on Earth, Inc. Common Stock|OTCX OTC LINK ECN ATS|OTCX|4500|2|2019-06-03
OTC|LGBI|Cannabiz Mobile, Inc .Common Stock|ARCA GLOBAL OTC|ARCA|191391|2|2019-06-03
OTC|LGBS|Legends Business Group, Inc. Common Stock|ARCA GLOBAL OTC|ARCA|150000|1|2019-06-03
OTC|LGGNY|Legal & General Group Plc 10p American Depositary Shares|ARCA GLOBAL OTC|ARCA|26204|56|2019-06-03
OTC|LGGNY|Legal & General Group Plc 10p American Depositary Shares|OTCX OTC LINK ECN ATS|OTCX|3300|8|2019-06-03
OTC|LGORF|Largo Resources Ltd Ordinary Shares|ARCA GLOBAL OTC|ARCA|1325|4|2019-06-03
OTC|LGORF|Largo Resources Ltd Ordinary Shares|OTCX OTC LINK ECN ATS|OTCX|5270|12|2019-06-03
OTC|LGRDY|LEGRAND SA Unsponsored ADR (France)|ARCA GLOBAL OTC|ARCA|5310|38|2019-06-03
OTC|LHSIF|Liberty Health Sciences Inc Ordinary Shares|ARCA GLOBAL OTC|ARCA|57420|36|2019-06-03
OTC|LHSIF|Liberty Health Sciences Inc Ordinary Shares|OTCX OTC LINK ECN ATS|OTCX|45747|30|2019-06-03
OTC|LIACF|American Lithium Corp. Ordinary Shares|ARCA GLOBAL OTC|ARCA|100|1|2019-06-03
OTC|LIACF|American Lithium Corp. Ordinary Shares|OTCX OTC LINK ECN ATS|OTCX|1000|1|2019-06-03
OTC|LIBE|Liberated Energy, Inc. Common Stock|ARCA GLOBAL OTC|ARCA|1800000|4|2019-06-03
OTC|LICT|LICT Corporation Common Stock|ARCA GLOBAL OTC|ARCA|10|1|2019-06-03
OTC|LIFZF|Labrador Iron Ore Royalty Corp. (Canada)|OTCX OTC LINK ECN ATS|OTCX|100|1|2019-06-03
OTC|LIGA|LIG Assets, Inc. Common Stock|ARCA GLOBAL OTC|ARCA|10000|1|2019-06-03
OTC|LIGA|LIG Assets, Inc. Common Stock|OTCX OTC LINK ECN ATS|OTCX|10000|1|2019-06-03
OTC|LINK|Interlink Electronics, Inc. Common Stock Common Stock|ARCA GLOBAL OTC|ARCA|125|1|2019-06-03
OTC|LINK|Interlink Electronics, Inc. Common Stock Common Stock|OTCX OTC LINK ECN ATS|OTCX|12124|4|2019-06-03
OTC|LINUF|LiNiu Technology Group Ordinary Shares (Cayman Islands)|ARCA GLOBAL OTC|ARCA|400|1|2019-06-03
OTC|LIQDQ|LIQUID HLDGS GROUP INC Common Stock undefined|ARCA GLOBAL OTC|ARCA|21700|2|2019-06-03
OTC|LIXT|Lixte Biotechnology Holdings, Inc. Common Stock|OTCX OTC LINK ECN ATS|OTCX|1100|1|2019-06-03
OTC|LLESY|Lendlease Corporation Limited American Depositary Receipts - Sponsored|ARCA GLOBAL OTC|ARCA|152|4|2019-06-03
OTC|LLESY|Lendlease Corporation Limited American Depositary Receipts - Sponsored|OTCX OTC LINK ECN ATS|OTCX|350|3|2019-06-03
OTC|LLLI|Lamperd Less Lethal Inc. Common Stock|ARCA GLOBAL OTC|ARCA|72000|11|2019-06-03
OTC|LLLI|Lamperd Less Lethal Inc. Common Stock|OTCX OTC LINK ECN ATS|OTCX|20700|3|2019-06-03
OTC|LMBHW|Limbach Holdings, Inc Warrant 07/20/2021|OTCX OTC LINK ECN ATS|OTCX|10000|6|2019-06-03
OTC|LMCNF|Leagold Mng Corp Ordinary Shares|ARCA GLOBAL OTC|ARCA|19000|33|2019-06-03
OTC|LMCNF|Leagold Mng Corp Ordinary Shares|OTCX OTC LINK ECN ATS|OTCX|2300|2|2019-06-03
OTC|LMRMF|Lomiko Metals Inc Ordinary Shares|ARCA GLOBAL OTC|ARCA|550|2|2019-06-03
OTC|LMWW|LMWW Holdings, Inc Common Stock|ARCA GLOBAL OTC|ARCA|2000|1|2019-06-03
OTC|LNGT|Laser Energetics, Inc. Common Stock|ARCA GLOBAL OTC|ARCA|325000|3|2019-06-03
OTC|LNSTY|LONDON STK EXCHANGE GROUP American Depositary Receipts - Unsponsored (United Kingdom)|ARCA GLOBAL OTC|ARCA|41921|125|2019-06-03
OTC|LNSTY|LONDON STK EXCHANGE GROUP American Depositary Receipts - Unsponsored (United Kingdom)|OTCX OTC LINK ECN ATS|OTCX|2010|2|2019-06-03
OTC|LNVGY|Lenovo Group Ltd Sponsored ADR (Hong Kong)|ARCA GLOBAL OTC|ARCA|9730|34|2019-06-03
OTC|LOGL|Legend Oil and Gas, Ltd Common Stock|ARCA GLOBAL OTC|ARCA|755100|4|2019-06-03
OTC|LOGX|PeerLogix, Inc. Common Stock|OTCX OTC LINK ECN ATS|OTCX|500|1|2019-06-03
OTC|LOMLF|Lion One Metals Ltd. Ordinary Shares (Canada)|ARCA GLOBAL OTC|ARCA|5000|2|2019-06-03
OTC|LOMLF|Lion One Metals Ltd. Ordinary Shares (Canada)|OTCX OTC LINK ECN ATS|OTCX|11096|2|2019-06-03
OTC|LOTE|Lot78, Inc Common Stock|OTCX OTC LINK ECN ATS|OTCX|21116|3|2019-06-03
OTC|LPPI|LEEP, Inc. Common Stock|ARCA GLOBAL OTC|ARCA|66472|2|2019-06-03
OTC|LPPPF|Loopshare Ltd. Ordinary Shares (Canada)|OTCX OTC LINK ECN ATS|OTCX|4005|2|2019-06-03
OTC|LQMT|Liquidmetal Technologies, Inc. Common Stock|ARCA GLOBAL OTC|ARCA|5000|1|2019-06-03
OTC|LQMT|Liquidmetal Technologies, Inc. Common Stock|OTCX OTC LINK ECN ATS|OTCX|260486|21|2019-06-03
OTC|LQSIF|Alcanna Inc. Common Shares|OTCX OTC LINK ECN ATS|OTCX|200|1|2019-06-03
OTC|LRENY|Lojas Renner S.A. Sponsored ADR (Brazil)|OTCX OTC LINK ECN ATS|OTCX|100|1|2019-06-03
OTC|LRGR|Luminar Media Group, Inc. Common Stock|OTCX OTC LINK ECN ATS|OTCX|200|1|2019-06-03
OTC|LRLCY|L'Oreal Co. American Depositary Shares|ARCA GLOBAL OTC|ARCA|12117|85|2019-06-03
OTC|LRLCY|L'Oreal Co. American Depositary Shares|OTCX OTC LINK ECN ATS|OTCX|3845|14|2019-06-03
OTC|LRSV|Link Reservations Inc. Common Stock|OTCX OTC LINK ECN ATS|OTCX|74055|10|2019-06-03
OTC|LRTTF|Liberty One Lithium Corp. Ordinary Shares (Canada)|OTCX OTC LINK ECN ATS|OTCX|5000|1|2019-06-03
OTC|LSAL|LaSalle Brands Corporation Common Stock|ARCA GLOBAL OTC|ARCA|30050|2|2019-06-03
OTC|LSKA|Liska Biometry, Inc. Common Stock|ARCA GLOBAL OTC|ARCA|1000|1|2019-06-03
OTC|LSYN|Liberated Syndication Inc Common Stock|ARCA GLOBAL OTC|ARCA|4109|3|2019-06-03
OTC|LSYN|Liberated Syndication Inc Common Stock|OTCX OTC LINK ECN ATS|OTCX|5264|6|2019-06-03
OTC|LTCP|Life's Time Capsule Services, Inc. Common Stock|ARCA GLOBAL OTC|ARCA|3400|2|2019-06-03
OTC|LTGHY|Life Healthcare Group Holdings Ltd Unsponsored ADR (South Africa)|ARCA GLOBAL OTC|ARCA|985|10|2019-06-03
OTC|LTMP|Alltemp, Inc. Common Stock|ARCA GLOBAL OTC|ARCA|51091|6|2019-06-03
OTC|LTMP|Alltemp, Inc. Common Stock|OTCX OTC LINK ECN ATS|OTCX|15200|2|2019-06-03
OTC|LTNC|Labor Smart Inc Common Stock|OTCX OTC LINK ECN ATS|OTCX|500000|1|2019-06-03
OTC|LTSC|Lightscape Technologies Inc. Common Stock|ARCA GLOBAL OTC|ARCA|75000|4|2019-06-03
OTC|LTSN|LTS Nutraceuticals, Inc. Common Stock|ARCA GLOBAL OTC|ARCA|3015855|15|2019-06-03
OTC|LTSN|LTS Nutraceuticals, Inc. Common Stock|OTCX OTC LINK ECN ATS|OTCX|770000|3|2019-06-03
OTC|LTTC|Lattice Incorporated Common Stock|ARCA GLOBAL OTC|ARCA|143700|6|2019-06-03
OTC|LTUM|Lithium Corporation. Common Stock|ARCA GLOBAL OTC|ARCA|18000|8|2019-06-03
OTC|LTUM|Lithium Corporation. Common Stock|OTCX OTC LINK ECN ATS|OTCX|61464|13|2019-06-03
OTC|LUCRF|Lucara Diamond Corporation Ordinary Shares (Canada)|ARCA GLOBAL OTC|ARCA|5170|5|2019-06-03
OTC|LUCRF|Lucara Diamond Corporation Ordinary Shares (Canada)|OTCX OTC LINK ECN ATS|OTCX|3100|5|2019-06-03
OTC|LUKOY|PJSC Lukoil American Depositary Receipts - Sponsored|ARCA GLOBAL OTC|ARCA|15228|64|2019-06-03
OTC|LUKOY|PJSC Lukoil American Depositary Receipts - Sponsored|OTCX OTC LINK ECN ATS|OTCX|2267|12|2019-06-03
OTC|LUNMF|Lundin Mining Corporation Common Shares (Canada)|ARCA GLOBAL OTC|ARCA|4504|13|2019-06-03
OTC|LUNMF|Lundin Mining Corporation Common Shares (Canada)|OTCX OTC LINK ECN ATS|OTCX|1220|11|2019-06-03
OTC|LUPAQ|Lupatech S A American Depositary Receipts - Sponsored|ARCA GLOBAL OTC|ARCA|2625|1|2019-06-03
OTC|LVGI|Limitless Venture Group Inc. Common Stock|OTCX OTC LINK ECN ATS|OTCX|1500000|4|2019-06-03
OTC|LVMUY|LVMH Moet Hennessy Louis Vuitton Unsponsored American Depositary Receipt (France)|ARCA GLOBAL OTC|ARCA|69527|168|2019-06-03
OTC|LVMUY|LVMH Moet Hennessy Louis Vuitton Unsponsored American Depositary Receipt (France)|OTCX OTC LINK ECN ATS|OTCX|13177|47|2019-06-03
OTC|LVRLF|CordovaCann Corp. Common Shares|OTCX OTC LINK ECN ATS|OTCX|6953|7|2019-06-03
OTC|LVVEF|Globalive Technology Inc Ordinary Shares (Canada)|ARCA GLOBAL OTC|ARCA|1000|1|2019-06-03
OTC|LVVV|Livewire Ergogenics, Inc.  Common Stock|OTCX OTC LINK ECN ATS|OTCX|10000|1|2019-06-03
OTC|LVXI|Las Vegas Xpress, Inc. Common Stock|ARCA GLOBAL OTC|ARCA|3176666|10|2019-06-03
OTC|LVXI|Las Vegas Xpress, Inc. Common Stock|OTCX OTC LINK ECN ATS|OTCX|2880000|8|2019-06-03
OTC|LWLG|Lightwave Logic, Inc. Common Stock|ARCA GLOBAL OTC|ARCA|10685|5|2019-06-03
OTC|LWLG|Lightwave Logic, Inc. Common Stock|OTCX OTC LINK ECN ATS|OTCX|16735|12|2019-06-03
OTC|LXGTD|Lexington Biosciences Inc Ordinary Shares|ARCA GLOBAL OTC|ARCA|3000|2|2019-06-03
OTC|LXRP|Lexaria Bioscience Corp. Common Stock|ARCA GLOBAL OTC|ARCA|39414|57|2019-06-03
OTC|LXRP|Lexaria Bioscience Corp. Common Stock|OTCX OTC LINK ECN ATS|OTCX|23775|17|2019-06-03
OTC|LYSDY|Lynas Corporation Ltd American Depositary Receipts - Sponsored|ARCA GLOBAL OTC|ARCA|100|1|2019-06-03
OTC|LZAGY|Lonza Group Ag Zuerich Unsponsored ADR (Switzerland)|ARCA GLOBAL OTC|ARCA|20653|111|2019-06-03
OTC|LZAGY|Lonza Group Ag Zuerich Unsponsored ADR (Switzerland)|OTCX OTC LINK ECN ATS|OTCX|3000|14|2019-06-03
OTC|LZRFY|Localiza Rent A Car Sa Sponsored ADR (Brazil)|ARCA GLOBAL OTC|ARCA|7532|59|2019-06-03
OTC|LZRFY|Localiza Rent A Car Sa Sponsored ADR (Brazil)|OTCX OTC LINK ECN ATS|OTCX|600|2|2019-06-03
OTC|MAIFF|Minera Alamos, Inc. Ordinary Shares (Canada)|OTCX OTC LINK ECN ATS|OTCX|35100|2|2019-06-03
OTC|MAKSY|Marks and Spencer Group plc American Depositary Shares|ARCA GLOBAL OTC|ARCA|49902|77|2019-06-03
OTC|MAKSY|Marks and Spencer Group plc American Depositary Shares|OTCX OTC LINK ECN ATS|OTCX|142|1|2019-06-03
OTC|MARUY|Marubeni Corp Ord American Depositary Shares|ARCA GLOBAL OTC|ARCA|21|1|2019-06-03
OTC|MATN|Mateon Therapeutics Inc Common Stock|ARCA GLOBAL OTC|ARCA|4700|1|2019-06-03
OTC|MAURY|Marui Group Co Ltd ADR (Japan)|ARCA GLOBAL OTC|ARCA|229|7|2019-06-03
OTC|MBCI|MabCure Inc. Common Stock|ARCA GLOBAL OTC|ARCA|200|1|2019-06-03
OTC|MBCQ|MB BANCORP INC  Common Stock|OTCX OTC LINK ECN ATS|OTCX|100|1|2019-06-03
OTC|MCET|MultiCell Technologies, Inc. Common Stock|ARCA GLOBAL OTC|ARCA|500000|2|2019-06-03
OTC|MCET|MultiCell Technologies, Inc. Common Stock|OTCX OTC LINK ECN ATS|OTCX|1000000|2|2019-06-03
OTC|MCHB|Mechanics Bank (The) (CA) Common Stock|OTCX OTC LINK ECN ATS|OTCX|1|1|2019-06-03
OTC|MCHOY|MultiChoice Group Limited Sponsored ADR (South Africa)|ARCA GLOBAL OTC|ARCA|20182|62|2019-06-03
OTC|MCHOY|MultiChoice Group Limited Sponsored ADR (South Africa)|OTCX OTC LINK ECN ATS|OTCX|150|1|2019-06-03
OTC|MCIC|Multicorp International, Inc. Common Stock|ARCA GLOBAL OTC|ARCA|62900|3|2019-06-03
OTC|MCIG|mCig, Inc. Common Stock|ARCA GLOBAL OTC|ARCA|10000|1|2019-06-03
OTC|MCIG|mCig, Inc. Common Stock|OTCX OTC LINK ECN ATS|OTCX|29800|2|2019-06-03
OTC|MCOA|Marijuana Company of America, Inc. Common Stock|ARCA GLOBAL OTC|ARCA|35000|4|2019-06-03
OTC|MCOA|Marijuana Company of America, Inc. Common Stock|OTCX OTC LINK ECN ATS|OTCX|44500|2|2019-06-03
OTC|MCPI|Mansfield-Martin Exploration Mining, Inc. Common Stock|OTCX OTC LINK ECN ATS|OTCX|13000|1|2019-06-03
OTC|MCRAA|McRae Industries, Inc. Class A Common Stock|ARCA GLOBAL OTC|ARCA|15|1|2019-06-03
OTC|MCTH|Medical Connections Holdings, Inc. Common Stock|ARCA GLOBAL OTC|ARCA|1000|1|2019-06-03
OTC|MCUJF|Medicure Inc. Ordinary Shares (Canada)|OTCX OTC LINK ECN ATS|OTCX|575|1|2019-06-03
OTC|MDCL|Medicine Man Technologies Inc Common Stock|ARCA GLOBAL OTC|ARCA|57917|122|2019-06-03
OTC|MDCL|Medicine Man Technologies Inc Common Stock|OTCX OTC LINK ECN ATS|OTCX|53688|112|2019-06-03
OTC|MDDT|Medico Intl Inc Common Stock|OTCX OTC LINK ECN ATS|OTCX|700|1|2019-06-03
OTC|MDLNF|Madalena Energy Inc Common shares (Canada)|ARCA GLOBAL OTC|ARCA|18981|2|2019-06-03
OTC|MDLNF|Madalena Energy Inc Common shares (Canada)|OTCX OTC LINK ECN ATS|OTCX|12500|2|2019-06-03
OTC|MDMN|MEDINAH MINERALS INC Common Stock|ARCA GLOBAL OTC|ARCA|14204|3|2019-06-03
OTC|MDRM|Modern Mobility Aids, Inc Common Stock|OTCX OTC LINK ECN ATS|OTCX|58940|7|2019-06-03
OTC|MDRPF|Midas Gold Corporation Ordinary Shares (Canada)|ARCA GLOBAL OTC|ARCA|452|1|2019-06-03
OTC|MDRPF|Midas Gold Corporation Ordinary Shares (Canada)|OTCX OTC LINK ECN ATS|OTCX|11200|3|2019-06-03
OTC|MDSYF|MODSYS INTL LTD Common Shares|ARCA GLOBAL OTC|ARCA|8300|2|2019-06-03
OTC|MDXG|MIMEDX GROUP INC Common Stock|ARCA GLOBAL OTC|ARCA|571661|78|2019-06-03
OTC|MDXG|MIMEDX GROUP INC Common Stock|OTCX OTC LINK ECN ATS|OTCX|72055|40|2019-06-03
OTC|MEDH|MedX Holdings, Inc. Common Stock|OTCX OTC LINK ECN ATS|OTCX|175110|2|2019-06-03
OTC|MEDIF|Medipharm Labs Corporation Common Shares (Canada)|OTCX OTC LINK ECN ATS|OTCX|11705|15|2019-06-03
OTC|MEDT|MediaTechnics Corporation Common Stock|ARCA GLOBAL OTC|ARCA|12050|1|2019-06-03
OTC|MEDT|MediaTechnics Corporation Common Stock|OTCX OTC LINK ECN ATS|OTCX|65000|1|2019-06-03
OTC|MEEC|Midwest Energy Emissions Corp. NEW Common Stock|ARCA GLOBAL OTC|ARCA|130|1|2019-06-03
OTC|MEGEF|Meg Energy Corp. Common (Canada)|OTCX OTC LINK ECN ATS|OTCX|9200|13|2019-06-03
OTC|MEGGY|Meggitt Plc Unsponsored American Depository Receipt (United Kingdom)|ARCA GLOBAL OTC|ARCA|500|1|2019-06-03
OTC|MERLY|Merlin Entertainments PLC American Depositary Shares - Sponsored|ARCA GLOBAL OTC|ARCA|3063|10|2019-06-03
OTC|MERLY|Merlin Entertainments PLC American Depositary Shares - Sponsored|OTCX OTC LINK ECN ATS|OTCX|100|1|2019-06-03
OTC|MERR|Merriman Holdings, Inc Common Stock|OTCX OTC LINK ECN ATS|OTCX|18064|2|2019-06-03
OTC|MFCO|Microwave Filter Company, Inc. Common Stock|OTCX OTC LINK ECN ATS|OTCX|15600|2|2019-06-03
OTC|MFST|Medifirst Solutions Inc Common Stock|OTCX OTC LINK ECN ATS|OTCX|104861|15|2019-06-03
OTC|MGAFF|Mega Uranium Ltd Ordinary Shares (Canada)|ARCA GLOBAL OTC|ARCA|200|1|2019-06-03
OTC|MGDDY|Michelin Compagnie Generale des Etablissements Michelin Unsponsored ADR representing Nom Shares (France)|ARCA GLOBAL OTC|ARCA|12632|26|2019-06-03
OTC|MGDDY|Michelin Compagnie Generale des Etablissements Michelin Unsponsored ADR representing Nom Shares (France)|OTCX OTC LINK ECN ATS|OTCX|9962|18|2019-06-03
OTC|MGMLF|Maple Gold Mines Ltd Common Shares|ARCA GLOBAL OTC|ARCA|13000|2|2019-06-03
OTC|MGON|Megola, Inc. Common Stock|ARCA GLOBAL OTC|ARCA|66000|1|2019-06-03
OTC|MGPHF|Mason Graphite Inc. Com (Canada)|ARCA GLOBAL OTC|ARCA|59200|6|2019-06-03
OTC|MGPHF|Mason Graphite Inc. Com (Canada)|OTCX OTC LINK ECN ATS|OTCX|14500|2|2019-06-03
OTC|MGPRF|MAG ONE PRODS INC  Ordinary Shares (Canada)|ARCA GLOBAL OTC|ARCA|5100|2|2019-06-03
OTC|MGTC|Megatech Corporation Common Stock|ARCA GLOBAL OTC|ARCA|4000|1|2019-06-03
OTC|MGTI|MGT CAP INVTS INC Common Stock|ARCA GLOBAL OTC|ARCA|289837|23|2019-06-03
OTC|MHGVY|Mowi ASA American Depositary Receipts - Sponsored|ARCA GLOBAL OTC|ARCA|16350|42|2019-06-03
OTC|MHHC|McCusker Holdings Corp. Common Stock|OTCX OTC LINK ECN ATS|OTCX|265000|1|2019-06-03
OTC|MHTX|Manhattan Scientifics, Inc. Common Stock|OTCX OTC LINK ECN ATS|OTCX|20360|4|2019-06-03
OTC|MIELY|Mitsubishi Electric Corp ADR|ARCA GLOBAL OTC|ARCA|1517|13|2019-06-03
OTC|MISM|Mission Mining Company Common Stock|ARCA GLOBAL OTC|ARCA|2100|3|2019-06-03
OTC|MITEY|Mitsubishi Estate Co Ltd American Depositary Shares|ARCA GLOBAL OTC|ARCA|22624|50|2019-06-03
OTC|MITSY|Mitsui & Company, Ltd. American Depositary Shares|ARCA GLOBAL OTC|ARCA|21|9|2019-06-03
OTC|MJARF|Mjardin Group Inc. Common Shares (Canada)|ARCA GLOBAL OTC|ARCA|49537|65|2019-06-03
OTC|MJARF|Mjardin Group Inc. Common Shares (Canada)|OTCX OTC LINK ECN ATS|OTCX|27294|84|2019-06-03
OTC|MJLB|Ultrack Systems, Inc. Common Stock|ARCA GLOBAL OTC|ARCA|47220|1|2019-06-03
OTC|MJNE|MJ Holdings, Inc.  Common Stock|ARCA GLOBAL OTC|ARCA|10505|11|2019-06-03
OTC|MJOGD|SecurCapital Holdings Corp Common Stock|ARCA GLOBAL OTC|ARCA|1|1|2019-06-03
OTC|MJTK|CannaSys, Inc. Common Stock|ARCA GLOBAL OTC|ARCA|134446|1|2019-06-03
OTC|MJTV|Michael James Enterprises, Inc. Common Stock|ARCA GLOBAL OTC|ARCA|150000|3|2019-06-03
OTC|MJTV|Michael James Enterprises, Inc. Common Stock|OTCX OTC LINK ECN ATS|OTCX|600000|3|2019-06-03
OTC|MKKGY|Merck KGaA, Darmstadt, Germany American Depositary Receipts - Sponsored|ARCA GLOBAL OTC|ARCA|13371|48|2019-06-03
OTC|MKKGY|Merck KGaA, Darmstadt, Germany American Depositary Receipts - Sponsored|OTCX OTC LINK ECN ATS|OTCX|419|5|2019-06-03
OTC|MKTAY|Makita Corp. American Depositary Shares|ARCA GLOBAL OTC|ARCA|959|6|2019-06-03
OTC|MKTAY|Makita Corp. American Depositary Shares|OTCX OTC LINK ECN ATS|OTCX|2657|8|2019-06-03
OTC|MLCG|ML Capital Group Inc Common Stock|ARCA GLOBAL OTC|ARCA|100|1|2019-06-03
OTC|MLER|Moller International, Inc. Common Stock|OTCX OTC LINK ECN ATS|OTCX|17000|1|2019-06-03
OTC|MLFB|Major League Football, Inc Common Stock|ARCA GLOBAL OTC|ARCA|19831|2|2019-06-03
OTC|MLFNF|Maple Leaf Foods Inc New Ordinary Shares|ARCA GLOBAL OTC|ARCA|600|3|2019-06-03
OTC|MLFNF|Maple Leaf Foods Inc New Ordinary Shares|OTCX OTC LINK ECN ATS|OTCX|5300|23|2019-06-03
OTC|MLHC|M Line Holdings, Inc. Common Stock|ARCA GLOBAL OTC|ARCA|375000|1|2019-06-03
OTC|MLRKF|Millrock Res Inc Common Shares|ARCA GLOBAL OTC|ARCA|43900|7|2019-06-03
OTC|MLRKF|Millrock Res Inc Common Shares|OTCX OTC LINK ECN ATS|OTCX|20900|5|2019-06-03
OTC|MLTC|Melt, Inc. Common Stock|ARCA GLOBAL OTC|ARCA|50000|3|2019-06-03
OTC|MLTC|Melt, Inc. Common Stock|OTCX OTC LINK ECN ATS|OTCX|10000|1|2019-06-03
OTC|MLWN|Malwin Ventures, Inc. Common Stock|ARCA GLOBAL OTC|ARCA|77600|2|2019-06-03
OTC|MLYFF|Nevada Clean Magnesium, Inc. Ordinary Shares (Canada)|ARCA GLOBAL OTC|ARCA|157835|4|2019-06-03
OTC|MMEG|Momentous Entertainment Group Inc. Common Stock|ARCA GLOBAL OTC|ARCA|1024|2|2019-06-03
OTC|MMEX|MMEX Resources Corporation Common Stock|ARCA GLOBAL OTC|ARCA|25000|1|2019-06-03
OTC|MMMM|Mineral Mtn Mng & Mlg Co Unclassified|ARCA GLOBAL OTC|ARCA|10350|3|2019-06-03
OTC|MMMM|Mineral Mtn Mng & Mlg Co Unclassified|OTCX OTC LINK ECN ATS|OTCX|2906|2|2019-06-03
OTC|MMMW|Mass Megawatts Wind Power, Inc. Common Stock|OTCX OTC LINK ECN ATS|OTCX|122618|11|2019-06-03
OTC|MMNFF|Medmen Enterprises Inc Ordinary Shares (Canada)|ARCA GLOBAL OTC|ARCA|90824|137|2019-06-03
OTC|MMNFF|Medmen Enterprises Inc Ordinary Shares (Canada)|OTCX OTC LINK ECN ATS|OTCX|38650|77|2019-06-03
OTC|MMSDF|MacArthur Minerals Ltd Ordinary Shares (Australia)|ARCA GLOBAL OTC|ARCA|15900|1|2019-06-03
OTC|MMTIF|Micromem Technologies, Inc. Ordinary Shares (Canada)|ARCA GLOBAL OTC|ARCA|139532|5|2019-06-03
OTC|MMTIF|Micromem Technologies, Inc. Ordinary Shares (Canada)|OTCX OTC LINK ECN ATS|OTCX|15000|2|2019-06-03
OTC|MNAP|MNP Petroleum Corporation Common Stock|ARCA GLOBAL OTC|ARCA|32000|1|2019-06-03
OTC|MNELF|Mission NewEnergy Limited Ordinary Shares|ARCA GLOBAL OTC|ARCA|10000|2|2019-06-03
OTC|MNTR|Mentor Capital, Inc. Common Stock|OTCX OTC LINK ECN ATS|OTCX|3150|5|2019-06-03
OTC|MOBQ|Mobiquity Technologies, Inc. Common Stock|ARCA GLOBAL OTC|ARCA|40000|10|2019-06-03
OTC|MOBQ|Mobiquity Technologies, Inc. Common Stock|OTCX OTC LINK ECN ATS|OTCX|23190|6|2019-06-03
OTC|MOCI|Modern Cinema Group, Inc. Common Stock|ARCA GLOBAL OTC|ARCA|2279|4|2019-06-03
OTC|MOJO|Mojo Organics, Inc.  Common Stock|OTCX OTC LINK ECN ATS|OTCX|12100|5|2019-06-03
OTC|MONOY|Monotaro Co. Ltd., Osaka Unsponsored ADR (Japan)|ARCA GLOBAL OTC|ARCA|3708|16|2019-06-03
OTC|MOTUY|Motus Holdings Limited Sponsored ADR (South Africa)|ARCA GLOBAL OTC|ARCA|347|1|2019-06-03
OTC|MOTUY|Motus Holdings Limited Sponsored ADR (South Africa)|OTCX OTC LINK ECN ATS|OTCX|2971|5|2019-06-03
OTC|MPGR|Mining Power Group, Inc. Common Stock|ARCA GLOBAL OTC|ARCA|4000|2|2019-06-03
OTC|MPOHY|MMI Holdings Ltd Sponsored ADR (South Africa)|ARCA GLOBAL OTC|ARCA|200|1|2019-06-03
OTC|MQBKY|Macquarie Group, Ltd. Sponsored ADR (Australia)|ARCA GLOBAL OTC|ARCA|2413|20|2019-06-03
OTC|MRAAY|Murata Manufacturing Co Ltd Unsponsored ADR (Japan)|ARCA GLOBAL OTC|ARCA|30045|118|2019-06-03
OTC|MRAAY|Murata Manufacturing Co Ltd Unsponsored ADR (Japan)|OTCX OTC LINK ECN ATS|OTCX|17400|18|2019-06-03
OTC|MRMD|MariMed Inc. Common Stock|ARCA GLOBAL OTC|ARCA|18598|53|2019-06-03
OTC|MRMD|MariMed Inc. Common Stock|OTCX OTC LINK ECN ATS|OTCX|101047|108|2019-06-03
OTC|MRPLY|MR PRICE GROUP LTD Sponsored ADR (South Africa)|ARCA GLOBAL OTC|ARCA|30924|91|2019-06-03
OTC|MRPLY|MR PRICE GROUP LTD Sponsored ADR (South Africa)|OTCX OTC LINK ECN ATS|OTCX|3345|12|2019-06-03
OTC|MRRTY|Marfrig Global Foods SA Sponsored ADR (Brazil)|ARCA GLOBAL OTC|ARCA|1250|13|2019-06-03
OTC|MRWSY|WM Morrison Supermarkets Plc Unsponsored ADR (UK)|ARCA GLOBAL OTC|ARCA|47756|102|2019-06-03
OTC|MRZLF|Mirasol Resources Ltd Common Shares (Canada)|ARCA GLOBAL OTC|ARCA|5080|3|2019-06-03
OTC|MRZLF|Mirasol Resources Ltd Common Shares (Canada)|OTCX OTC LINK ECN ATS|OTCX|860|1|2019-06-03
OTC|MSADY|MS&AD Insurance Group Holdings, Inc. Unsponsored ADR (Japan)|ARCA GLOBAL OTC|ARCA|23409|54|2019-06-03
OTC|MSADY|MS&AD Insurance Group Holdings, Inc. Unsponsored ADR (Japan)|OTCX OTC LINK ECN ATS|OTCX|200|2|2019-06-03
OTC|MSBHY|Mitsubishi Corp Ord American Depositary Shares|ARCA GLOBAL OTC|ARCA|9703|48|2019-06-03
OTC|MSHFQ|MediaShift, Inc. Common Stock|ARCA GLOBAL OTC|ARCA|102247|3|2019-06-03
OTC|MSNI|Mon Space Net, Inc. Common Stock|OTCX OTC LINK ECN ATS|OTCX|260|4|2019-06-03
OTC|MSPC|Metrospaces, Inc. Common Stock|ARCA GLOBAL OTC|ARCA|482685|2|2019-06-03
OTC|MSRT|Massroots, Inc. Common Stock|OTCX OTC LINK ECN ATS|OTCX|6000|2|2019-06-03
OTC|MSSV|Meso Numismatics, Inc. Common Stock|ARCA GLOBAL OTC|ARCA|3565|4|2019-06-03
OTC|MTLQU|Motors Liquidation Company GUC TR Units of Beneficial Interest|ARCA GLOBAL OTC|ARCA|4465|91|2019-06-03
OTC|MTNOY|MTN Group, Ltd. Sponsored American Depositary Receipt|ARCA GLOBAL OTC|ARCA|27|3|2019-06-03
OTC|MTNOY|MTN Group, Ltd. Sponsored American Depositary Receipt|OTCX OTC LINK ECN ATS|OTCX|200|1|2019-06-03
OTC|MTSFY|Mitsui Fudosan Co Ltd Unsponsored ADR (Japan)|ARCA GLOBAL OTC|ARCA|953|3|2019-06-03
OTC|MTSFY|Mitsui Fudosan Co Ltd Unsponsored ADR (Japan)|OTCX OTC LINK ECN ATS|OTCX|221|3|2019-06-03
OTC|MTTRY|Ceconomy AG American Depositary Receipts - Unsponsored|ARCA GLOBAL OTC|ARCA|1374|3|2019-06-03
OTC|MTZPY|Mitsubishi Tanabe Pharma Corporation Sponsored ADR (Japan)|ARCA GLOBAL OTC|ARCA|12928|29|2019-06-03
